Review_ID,Rating,Year_Month,Location,Review_Text,Branch
663906165,3,2019-03-01,Ireland,"Still a huge attraction and still wildly overpriced.We travelled as a family of 8 for a 21st birthday with an age range from 3 to 73Most of the attractions were closed for refurbishment but there were some closed that were not on the advertised list.We stayed in the Santa Fe which is functional, opted for room only this time as they wanted    19 a head for a very poor breakfast offering, this was included last time we stayed. To be honest though you are better off eating elsewhere as it   s a bun fight with hundreds of people handling and poking the food your expected to eat.The hotel is a nice walk from the park along the canal and saves the scramble for the bus.With the exception of the hotel, service and politeness seem to have been abandoned completely. It would seem delivery of cold food is the norm across most of the restaurants with Annette   s diner being the worst offender. If you want a cold breakfast with poor service go there. Even McDonalds have managed to take the    fast    out of fast food as one of the slowest ever experienced.The rides are now getting tired and the fast pass system is in the dark ages, they could benefit from a system like Florida with the wristband for entry and for fast passes. However you would need reliable Wi Fi for that which is not the case here it   s dreadful with constant drops the app freezes and very slow and this is across a range of up to date phones on iOS and Android. Wi Fi needs attention it can   t seem to cope with the load placed on it.It   s still a joy to watch the kids faces when they meet their favorite superhero or when they get on a ride the anticipation is real. That said I feel Walt would be disappointed with the commercialism that   s crept in with trying to extract as much as possible out of people with little in return by way of value for money and encouraging families to spend time together to truly make magical memories.",Disneyland_Paris
560092101,3,2018-02-01,Canada,I was so looking forward to our Disney vacation but I have to say that it was a disappointment!! This was my first time to the park and my last!! The 3 (2 on California and 1 on Disneyland side) rides that we wanted to go on were CLOSED!! Plus there were major issues with other rides. Why would they close the Ferris Wheel and the roller coaster at the same time?? We spent good money to travel there feeling like we wanted more out of our experience than we had. I truly did not get the magical feeling that they portray in their advertisements. I wish I went to MEXICO instead :(,Disneyland_California
151541297,5,2013-02-01,United States,Superbowl Sunday wasn't super crowded!  The new prices for a year long pass is higher than usual   I think this means the economy is recovering!,Disneyland_California
532880611,5,2017-09-01,Singapore,"1 full day was about right for me to go through most of the attractions. Many of the rides are very engaging and interactive. But if you are looking for more high elements scary rides, this may not be the best place to go.Love the night show and fireworks, and the halloween theme decorations and performances.",Disneyland_HongKong
21172119,5,,United Kingdom,"This is our third time to Disney in the past 15 years and i feel it getting better all the time, We travel by car and stayed at the Dream castle which was excellent, To enjoy Disney paris you must remember several things ! These are you are now in Europe so do push and shove it's what the Frence and Germans do, if not you wont't get anywhere ! Expect to pay higher prices this is Disney and you near Paris so cost will be higher, Also prepare for the wether to be chilliy, we went on the Ocotber 12th for 2 nights & 3 days and the park was wouderful in it's holloween season my 4 year old daughter loved it and remember it's a place you visit only a few time in your life, so take the pain of a folking out money and take a look of you kids faces you will see it's worth every penny,",Disneyland_Paris
126894832,5,2012-03-01,United Kingdom,"loved everything about this park although the que for rides and to see characters tok up alot of time it was still brilliant, id advise to go to he princess pavillion to see the disney princesses there was an avarage waiting time of 2 hours but if you go about 12pm its just under an hour ",Disneyland_Paris
322017871,5,2015-10-01,Iran,what an amazing place .You feel like a kid all over again! magical place.Although the lines were loooong and feet killer and it was extremely hot but it's worth it.,Disneyland_California
176093811,4,2013-09-01,Switzerland,"Having been to so many theme parks I do not get it that why is it there no designated smoking area for this park still. There are so many children and yet smokers are walking around with a cigarette in their hands! Located next to Walt Disney studios.Pro:1. Park fairly well maintained.2. Queue was short. Most is a 30mins wait.Con:1. There were technical faults at space mountain. So the ride was cancelled. In total, there were 4 technical faults in both the parks. This is the first time I have encounter so many such technical faults in a theme parks.2. The staff lack enthusiasm, compared to US.3. Did not see any Disney character at all!Tips:1. Buy your ticket online. It's cheaper. We got ours at isango with a promo for 20th Disney anniversary , visit 2 parks in a day.2. Lots of water coolers around to top up your bottles.Hope it helps.",Disneyland_Paris
133845903,4,2012-07-01,Philippines,"A must see attraction on your first trip to Hong Kong.To make sure it's sweet and short, here are tips for you:  1 whole day is definitely enough to explore the magical place     Make sure it's a sunny day on your visit as I've been told parades are canceled when it's pouring.  Yes, it's a sunny day which means an umbrella should be brought for the walks from one magical ride to another.  As soon as you enter the area, get a map and plan your route as you don't want to miss meeting all those wonderful Disney characters during parades. There are 2 parades: 12nn HKT and 4pm HKT.  Fireworks display starts at 9PM HKT. Make sure you get a good spot in front as besides the fireworks, they also have a slideshow projected on the walls of Sleeping Beauty's castle which you won't see if you're at the back.  Food is expensive (At least for me, after converting price to local currency   PHP, I wanted to eat even the plate) ! They have 2 food courts which offer different cuisines. Asian (noodles and rice meals) and American ( fried chicken and burgers). They have food stands too which offer ice creams, pop corns, hotdogs, etc. The two piece fried chicken with rice and coke I ate for lunch costs 88HKD if I remember it right. Price range of meals are from 70HKD 100HKD. Food portion is good for 1 regular person with regular appetite. Haha! They do not serve hot sauce, only sweet chili sauce.  Food cannot be brought in so if you are on a budget you can save by buying 1 big bottle of water drink inside then keep the bottle as there are water fountains in the area. One can be found near Buzz Lightyear's area   before you enter the restrooms. One bottle of 12ml of orange juice costs 26HKD, but it really tasted good.  Hated the It's a Small World attraction. It's just 10 20 minutes but I don't see anything Disney about it. It's just all dolls, some of which, creeped me out. Looked like a ride from a very rusty carnival ride. Not a loss if you skip this, but if you have time and you wanted to rest, go ahead.It is, indeed, one of the happiest places on earth. Missing a visit to Hong Kong Disneyland is definitely a No No!",Disneyland_HongKong
454829794,5,2016-12-01,United States,"This is the smallest Disneyland we visited, but we enjoyed every moment there. There's minimal wait , longest was Dumbo  50 min. Other than that we got on all the rides in a day. Don't get me wrong, although you can get on all the rides in a day, you can easily spend 2 days there to fully enjoy the park. Crew members are friendly, and we love to collect the stickers they hand out. Food is awesome, reasonable price too.We took MTR from Kowloon, and the Disney line train is very pleasant to ride. Yes, we will definitely go back next time we are back to Hong Kong ",Disneyland_HongKong
138682536,5,2012-08-01,Russia,"It was really a dream! I strongly recommend that everybody should visit this marvelous place at least one time. There was a big family of us: my daughter, her husband and their two daughters (4 and 6 yo) and me. Everybody of us was happy, really. I noticed that this park is more attractive for adult! You should see happy faces of men and women eating ice cream and laughing like babies. And sparkling yes! I will visit the Park again for sure.",Disneyland_Paris
307429695,3,2015-09-01,Australia,"This was my first trip to a Disneyland, so i was so excited and it was great, but a little disappointing. Quite small and we had most of it covered in approx 2 hrs. There are only a few adult rides, mostly things for kids to do and families, but the few rides were fun. Now i want to go to all the others and see what they are like?",Disneyland_HongKong
307979631,3,2015-03-01,Costa Rica,I visited this park in the 1960's and took my daughter here in the spring for 2 days. We had a really good time. There were a few rides shut down and we were a bit disappointed but we didn't let it deter us from enjoying our visit. I scouted the internet for discounted park tickets and found none. Don't waste your time. Fairly pricey. Souvenirs were pricey as well as food. We opened and closed the park. The firework show is good but since I produce fireworks shows my daughter and I took advantage of that time to get on popular rides fast. I'd suggest doing this if you only have a day or two to visit the park.  The Disney parade is very entertaining even for a fifty year old. I'll never forget the look on my 13 year old daughters face during the parade. She was a little girl all over again which was worth the price of admission. All in all the two of us had a great time. We liked California Adventure better though.,Disneyland_California
200172804,4,2014-04-01,United Kingdom,"I hate theme parks. I really hate them. But Disney got me with their magic! Admittedly we went mid week out of school holiday time so it was quiet. We never queued for more than ten minutes for a ride. So in two days we had gone around the whole park at least twice! Staff are good, lots of places to eat and drink and its very clean. There are rides for all ages (our 3 year old son was never bored) and our 7 year old could go on most rides too. The Parade and lights firework shows were good and the mid day mini parades were fun. I cant think about anything that wasn't good! It makes the UK theme parks look really pathetic.",Disneyland_Paris
126232420,5,,United States,Each time I have had the privilege to visit Disneyland I've had a wonderful time.  It is truly the Magic Kingdom.,Disneyland_California
267385230,5,2015-03-01,United Kingdom,We went to DLP in March 2015 and loved it! We bought food vouchers with our package and found them to be very good value. The Half Board Plus vouchers could be redeemed in some really lovely restaurants such as The Steakhouse and the Manhattan Restaurant. Be aware that you need to make restaurant reservations before you attend and the international hotline is very expensive! I was on the phone from my BT landline for 10 minutes and it cost me   5.30. There was a free restaurant hotline on the hotel phone! A great family holiday!,Disneyland_Paris
348461158,2,2016-02-01,Mexico,"One of the most boring experiences of my long life. This park is a shoppers dream but, lacks any substance. Both Disneyland and California Adventure Park are so full of touristy shops selling t shirts that they almost forgot to include any attractions. Some of the lines for rides were hours long. Certainly not this girl's cup of tea.",Disneyland_California
177734474,3,2013-09-01,Australia,"This was our first visit to Disney and it was a great place to see and experience but there is not alot for adults to do. The restaurants and cafes were overpriced but that is expected in a place like Disney. It crowded and we had to line up to for toilets,icecream,lunch,rides and everything we did which took up alot of time.It is worth a visit if your taking children otherwise i prefer universal studios in la.",Disneyland_California
201453244,4,2013-05-01,United Kingdom,very nice place very nice staff characters but for me a little too young.  I did enjoy the train on the way as it was specifically stickered with minnie and mickey mouse ears on the floor which was a nice touch,Disneyland_HongKong
284776244,4,2015-06-01,United States,We recently visited and enjoyed the parks. Loved that Ratatouille ride and enjoyed the Indiana Jones coaster. Parents of young riders should be aware that the Haunted Mansion and Big Thunder Mountain rides have a lot of time in the dark compared to WDW. The parks are a little smaller than WDW and easier to navigate.I guess we are spoiled by the cleanliness of WDW as we were a little disappointed to find litter and weeds in the landscaping and on the walkways from the Disney hotels to the Disney Village. There is a great deal of renovations going on so maybe this area isn't getting the attention it normally does.It was still a great day at Disney parks and we enjoyed the new experience!,Disneyland_Paris
79588178,4,,United States,"We have not been at a Disney theme park in about 5 years, and we decided it was time to visit. My husband, daughter age 20 and son age 21 went for a three day pass and stayed at the Disneyland Hotel. This is our 5th trip to Disneyland, and we expect that some rides will be closed due to maintenance refurbishment, but we were really surprised at the amount of rides that were down due to technical problems. Space Mountain was closed down for an entire day. California Adventure is undergoing a major renovation   half the park is under construction and new attractions are coming in 2012. The World of Color is amazing and well worth the wait to see. Be aware that there are no seats for this show   you will be standing for the entire show. We still enjoyed ourselves and were able to ride everything we wanted with a minimal wait thanks to the fastpass system. Be careful of food prices   it is really expensive to eat inside the park.",Disneyland_California
399989706,5,2016-07-01,United Kingdom,A little disappointed on the ride closures as they are updating the park   never a good time to do this when its opened all year round! Strongly advise you check before booking or telling the kids what rides they can go on just in case they are closed. Plenty of different rides.,Disneyland_Paris
464761511,3,2017-03-01,United States,"I've been to Disney World multiple times and it's always been a great experience. We decided this time we wanted to try Disneyland. I have to say I was very disappointed with the experience. Everyone knows Disney isn't cheap but most people are ok paying because you know you're going to get a great experience, or so we thought. My first complaint would be the number of rides that were closed during our visit. Most people make plans for a trip to Disney months in advance but Disney will often release ride closures on very short notice. We knew about part of the park being closed while they work on Star Wars land and were ok with that. I assumed that meant that the other rides would be open. I was very disappointed to see just in the last couple weeks that in addition to the closures for Star Wars construction the Pirates of the Caribbean and Matterhorn Bobsleds would be closed as well. This was especially aggravating as these were the 2 rides that were different than Disney World that we wanted to experience. In addition to the ride closures we also experienced multiple unexpected temporary ride closures. We were in line 3 times where the ride broke down and they had to shut the rides down temporarily. Even the monorail was broken when we tried to ride that. The crowds were also a problem. We went during what was expected to be one of the slowest weeks of the year for the park and it was still quite crowded. Lines were often long for the attractions. I can't imagine coming here during peak season.Perhaps we were lucky on our previous trips to Disney World but we never experienced these problems before and again when you are paying Disney prices you expect a better quality. In the future we'll be sticking to the Florida parks.",Disneyland_California
471893804,5,2017-03-01,Canada,"We went during spring break and it was busy but never stood in line for more than 40 min. Disneyland is the master of lines keeping you entertained while making them look small.The three things you will NEED is the park hopper pass, Disneyland app and your phone with data. The app show closed attractions, washrooms, length of lines, fast pass times and where and when Characters can be found. Fast passes will ensure you do not spend your vacation standing in lines. We had our older son who would run ahead and get our fast pass then we would go to the other park and get a fast pass there. Then we would plan our rides based on lineup times until we could use our fast pass and get another. We did 5 days and only had a couple of rides we wanted to do on day 5 and spent allot of the day repeating our favorite ones. We rented strollers for the two little girl's 6 and under. This is a must because you cover a lot of ground in a day. We left all our stuff in the strollers and never had any issues until the last night when someone grabbed the wrong stroller after the fireworks. We got all our stuff back the next morning except 1 souvenir cup ( they throw out any containers that contain or possibly contain liquids). Disneyland did replace the cup free of charge which was fantastic. This trip can be expensive with the dollar exchange but is a must for families. My recommendation would be to take kids when they are between 6 an 10 as they can ride almost any ride and they really appreciated the magic of the park. ",Disneyland_California
564833278,5,2018-03-01,United Kingdom,"We took our young grandchildren with us, this was a hit with them they enjoyed snow white, dumbo, its a small world, teacups, a must for any visit if you can is to attend Breakfast with the characters, that saves some time in queuing up to see them, and it is also a great american buffet breakfast as well, we met Mckey, Donald, Daisy, Tigger, Eoi,Dr, Staying at a disney hotel we was able to enter the park at 8am and by 6pm we had had enough, but the parade at 5pm was great as well, if we were to go again we would definately go when it was a bit warmer.",Disneyland_Paris
120925981,3,2011-11-01,United States,"TOP TIP: For the evening fireworks go to it's a smaal world, it's less crowded you can still hear the music and have a great view of the fireworks (excluding the 3 4 they set off from the castle) and afterwards they make it snow on the crowd. Very magical.You cant beat Disneyland for it's Christmas efforts, re theming rides, decorations, parade, fireworks, it was all very good.Problem   compared to Magic Kingdom at Disney World, and pretty much every park I've ever been to it is very, very, very crowded. I know it's the most visisted park in the world but it doesnt help that the main paths from area to area aren't big enough or if they are are taken up by stroller parking (especially Tomorrowland). The lines weren't too bad, longest wait I did was 40 mins for the roger rabbit ride as i made good use of fastpass, but if you didnt use the fastpass then some rides were 65 70 mins.Food & drink was very expensive even for a theme park. One slice of pizza cost me $7.Overall a great time but I'm not rushing back.",Disneyland_California
423248287,5,2016-09-01,United States,"Loved this small Disneyland park. From someone who is a frequent visitor to WDW in Florida (which is HUGE), this small park was a welcome change. The weather was ridiculously hot but we enjoyed touring this park for two days. Could have been done in one day but it was nice to stay at the hotel when the heat was the worst. This is a beautifully landscaped, clean park. The ride lines were short when we were there and we enjoyed riding a couple rides (such as Mystic Manor) that are unique to HK Disneyland. Hong Kong on the whole is a beautiful place, the people are friendly and it is very much  western  friendly with most people speaking English. My only complaint is there could be more quick service restaurants with more  western  food. Trying to find food other than snacks in the park was very challenging. I would love to return to HK to spend more time and in doing so would return to HK Disneyland.",Disneyland_HongKong
640133477,2,2018-12-01,Australia,"Rides were good, need a lot of patience. Family of 4 got in a combined 14 rides, ( 3.5 rides each)(3 mins each ride) waited an average of 40 minutes  ride. Figured it cost $1:00 minute for my family to be in eurodisney. ($500.  for the day).Waited 20 mins to get coffee, 35 mins to get a bite to eat etc. etc.Poor value for money because of poor organisation by Disney. Dread to think what it is like in peak periods.",Disneyland_Paris
329990097,5,2015-11-01,United Kingdom,"My children are 10, 9, 5 and 3 and they all loved it. Even as parents we enjoyed it as well.As the park was designed with Chinese people in mind, you'll find that younger children can go on the more thrilling rides.My 3 year old was talk enough to go on Space Mountain for example. There are some limitations in height and weight, so some of you taller or heavier folk may have challenges.We struggled to find vegetrian food, but the Main Street diner had the widest choice. Although popcorn, fries, etc were available.The park is relatively small, on par with the UK theme parks, so on a quiter dat only on dat is needed. If you go on a busier day (Chinese public holiday or weekend) it may be worth considering a two day ticket.Catch the parades, they are fun and stay late for the fireworks but be aware that the park and shops close soon after, so it will be busy on the MTR.",Disneyland_HongKong
142306132,5,2012-10-01,United States,It's Disneyland....Need I say more. One word describes this place......MAGICAL.....Firework show is the best out there.,Disneyland_California
130157792,5,2012-05-01,Netherlands,"Just let it all come over you. Of course you have to wait and of course it isn't cheap, just enjoy!!",Disneyland_Paris
83146163,4,,United States,Disneyland Park in Los Angeles exceeded my expectation where everyone were telling me that it doesn't worth the visit. But what I saw is completely different.,Disneyland_California
173372421,4,2013-08-01,United States,"For 18 years we traveled from Northern California to Disneyland two or three times a year. We took two or so years off and then made the decision to go this past week for my husband's birthday. The park is still clean and the landscaping is beautiful once you get in the gates. We had magic mornings because we stayed at a Disney Hotel. This enabled us to ride all the attractions early in the day, get fast passes, and not feel the rush of the crowds. While the magic is still there, the cast members smile a little less, and at times we found they don't know the rules so apply them inconsistently. This is a big change from a few years ago.Getting through the gate can be a hassle unless you have a Season Pass. Multi day passes are scanned first by a person at the outside gate. If your photo matches your pass, you proceed to the turnstile to pass through. Before all of this you must go through the bag check line whether you have a bag or not. Over the years we have suggested a separate line for those without bags to no avail. BUT, no matter, we had a wonderful time. Be prepared to spend money for food, tickets, drinks, etc. or take in your own lunch and snacks. Have fun.",Disneyland_California
225318058,3,,New Zealand,"Had a good day out here but it wasn't fantastic. Great infrastructure and we thoroughly enjoyed the Aerosmith ride, but overall the park is a bit tired. Food was average and junky, nothing healthy was available which was unfortunate. After    24 for a poorer version of McDonalds we felt robbed and slightly worse for wear. Fast pass idea is flawed, we went to space mountain to get a fast pass and the fast pass line looked just as long as the regular line. Defeats the purpose really! Queuing was 90 minutes at the ratatouille ride, and we were informed that fast passes were no longer available, so had to go without. Not sure about the logic here.We did not come across any staff who looked pleased to be at work, except for the dancers in the Main Street USA area. Staff operating the food stalls especially were unhelpful and snooty, which brought down the happy and cheery Disney experience.Thoroughly recommend buying tickets to both parks which we did upon recommendation by our hotel, there is not enough to do in either park alone. Had a great time at Disneyland in Los Angeles a few years ago, but was sadly disappointed by Paris's version. Would not come back",Disneyland_Paris
151646592,5,2012-12-01,Malaysia,One of the MUST visited place especially for family. You and your family would definitely have great fun surrounded with excitement. The park is very clean. I will definitely come back!,Disneyland_HongKong
