review_id,touchpoint,sentiment,code,text_excerpt,travel_party,first_visit,visit_timing
281157737,food/beverage,positive,good corn dog quality,Corn dogs were 7.50 but really good.,,Yes,
3845337,recommendation,neutral,overall fabulous experience,Me and my young family think that Disneyland in Paris is fabulous!,family,no,"Easter, August, Christmas"
3845337,comparison,neutral,comparing disney parks,and I couldn   t honestly say which is better,family,no,"Easter, August, Christmas"
3845337,comparison,neutral,comparing disney parks,Disney World is bigger and it   s all in English but it   s so far away!,family,no,"Easter, August, Christmas"
3845337,comparison,negative,florida weather unbearably hot,it can get unbearably hot which can make the Disney experience miserable,family,no,"Easter, August, Christmas"
3845337,navigation,negative,heat saps energy,The heat saps everyone   s energy and makes everyone irritable.,family,no,"Easter, August, Christmas"
3845337,comparison,negative,disneyland paris is expensive,People also say that Disneyland Paris is expensive,family,no,"Easter, August, Christmas"
3845337,food/beverage,negative,expensive food and snacks,"cost of accommodation, food, snacks",family,no,"Easter, August, Christmas"
3845337,retail,negative,expensive gifts,"or gifts, Disney isn   t cheap",family,no,"Easter, August, Christmas"
3845337,attractions,negative,imbalance between parks,there is a major imbalance between the Disneyland Park and the Disney Studios.,family,no,"Easter, August, Christmas"
3845337,attractions,negative,lack of studio attractions,We struggle to find things to do at the Studios in Paris,family,no,"Easter, August, Christmas"
3845337,comparison,positive,space use is phenomenal,the use of space in Disneyland is phenomenal with so much packed in,family,no,"Easter, August, Christmas"
3845337,staff,positive,staff speak good english,most of the staff speak pretty good English,family,no,"Easter, August, Christmas"
3845337,staff,positive,effort during the shows,they make a good effort during the shows too,family,no,"Easter, August, Christmas"
3845337,facilities,positive,disneyland hotel enjoyment,staying here has made our visits so much more enjoyable,family,no,"Easter, August, Christmas"
3845337,cleanliness,positive,how clean it is,The first thing that strikes you about any Disney Park is how clean it is.,family,no,"Easter, August, Christmas"
3845337,atmosphere,positive,fabulous attention to detail,Then you might notice the fabulous attention to detail.,family,no,"Easter, August, Christmas"
3845337,cleanliness,positive,pristine flowerbeds,"the flowerbeds, trees and grass are always pristine",family,no,"Easter, August, Christmas"
3845337,timing,positive,earlier is better,THE EARLIER THE BETTER!,family,no,"Easter, August, Christmas"
3845337,attractions,positive,minimal wait times early,you more or less have the park to yourself and can walk up to any ride and get on pretty much straight away,family,no,"Easter, August, Christmas"
3845337,attractions,negative,packed at noon,by 12:30 1:00pm everywhere will be packed,family,no,"Easter, August, Christmas"
3845337,attractions,positive,enjoyable disneyland park,we enjoyed everything that we did,family,no,"Easter, August, Christmas"
3845337,attractions,neutral,mention of queues,Yes you have to queue sometimes,family,no,"Easter, August, Christmas"
3845337,entertainment,positive,wonderful parades,Both of the parades were wonderful,family,no,"Easter, August, Christmas"
3845337,entertainment,positive,especially good parade,This Fantalusion Parade which was on at 10:30pm was especially good.,family,no,"Easter, August, Christmas"
3845337,entertainment,positive,spectacular firework display,Wishes Firework Display which was nothing short of spectacular,family,no,"Easter, August, Christmas"
3845337,facilities,positive,easy buggy hire,we hired one which is easy to do,family,no,"Easter, August, Christmas"
3845337,facilities,neutral,buggy hire cost,costs    6.50 a day,family,no,"Easter, August, Christmas"
3845337,attractions,positive,awesome stunt car show,the Stunt Car Show which is awesome,family,no,"Easter, August, Christmas"
3845337,recommendation,positive,recommend disneyland hotel,I would definitely recommend the Disneyland Hotel!,family,no,"Easter, August, Christmas"
3845337,recommendation,positive,cannot fault trip,All in all I cannot fault a trip to Disneyland in Paris,family,no,"Easter, August, Christmas"
3845337,recommendation,positive,kids will love you,and your kids will love you for it!,family,no,"Easter, August, Christmas"
358762714,staff,positive,friendly and smiley staff,everyone friendly and smiley,,,
358762714,characters,positive,loads of character meets,Loads of characters to meet,,,
358762714,entertainment,positive,brilliant forest show,Forest show brilliant,,,
358762714,entertainment,positive,spectacular disney dreams show,Disney dreams is spectacular,,,
358762714,atmosphere,negative,cold evening atmosphere,but gets colder,,,
358762714,food/beverage,neutral,take blankets and snacks,so take blankets and snacks,,,
402625721,comparison,neutral,comparing other disney parks,compare it to the LAX and MCO versions,family,Unknown,
402625721,navigation,neutral,smaller park size,Definitely a lot smaller but it was still fun,family,Unknown,
402625721,attractions,neutral,limited fastpass attractions,only two fast pass attractions,family,Unknown,
402625721,navigation,positive,smaller crowds,crowds were not that big,family,Unknown,
16750021,comparison,negative,disney experience lacking,"I found that the Disney Experience was lacking. It felt like an amusement park and not the total immersion into the Happiest Place on Earth, I get in Anaheim.",couple,no,May 7 2008
16750021,attractions,negative,hot indoor rides,"all the indoor rides; Haunted House, Pirates, Space Mtn were hot and stuffy",couple,no,May 7 2008
16750021,retail,negative,difficulty finding souvenirs,were surprised we had a hard time finding something to purchase as a souvenirs,couple,no,May 7 2008
16750021,recommendation,neutral,may return for visit,"We may go back, one day, spend a few days at the resort to give it another chance.",couple,no,May 7 2008
16750021,attractions,positive,favorite rollercoaster found,"Besides, my new favorite rollercoaster is there .Rock n Roller coaster featuring Aerosmith.",couple,no,May 7 2008
131732678,staff,negative,staff disdain towards foreigners,they don't like foreigners and as tourists tend to be foreigners they make up the majority of visitors here and thus obviously annoys the staff!,family,Unknown,
131732678,staff,negative,rude staff behavior,if you are British you get treated with utter disdain,family,Unknown,
131732678,characters,negative,goofy rude to child,Try explaining to your six year old child why Goofy pushed him out of the way so the French child could take priority for the photograph,family,Unknown,
131732678,staff,negative,lack of disney experience,"operators of this park have not got a handle on how to create a Disney experience complete with smiles, laughter and 'feel good' atmosphere",family,Unknown,
131732678,entry/admission,negative,expensive entry fee,You resent paying 200 euros for your family to get in,family,Unknown,
131732678,staff,negative,rude staff interaction,"to be snarled at, shrugged at",family,Unknown,
131732678,navigation,negative,queuing unpleasant experience,pushed and jostled roughly in the queue you have stood in for over an hour by other people of local nationality.,family,Unknown,
131732678,attractions,negative,queue jumping incident,four loud local teenage girls come from under the barrier and stand in front of them. The attendants say nothing,family,Unknown,
131732678,food/beverage,negative,overpriced junk food,Food   overpriced junk,family,Unknown,
131732678,facilities,negative,filthy toilet conditions,"Toilets   filthy, take your own toilet paper if you   like most people   tend to use it",family,Unknown,
131732678,facilities,negative,smoking endangers children,Health and Safety   it is the French habit to smoke everywhere so be prepared to endure the stink   mind your young children's eyes and cigarettes are held down at their eye level...as mentioned in several reviews here...dangerous!!!!,family,Unknown,
131732678,navigation,negative,queue pushing behavior,Queuing   stand your ground over your place in the queue   you WILL get pushed in front of!,family,Unknown,
131732678,staff,negative,staff feign ignorance,Language   speak French...? so do we   but the staff like to pretend you cannot.,family,Unknown,
481342978,navigation,neutral,park size affects navigation,It takes a while to get through them though.,,,
481342978,timing,neutral,park visit two days,It is a 2 day trip.,,,
281222352,staff,negative,"unwelcoming, unfriendly staff",no one was welcoming or friendly,,,
281222352,staff,negative,rude staff interactions,The staff was rude,,,
281222352,attractions,negative,excessive ride queues,the lines were way too long,,,
281222352,facilities,negative,filthy restroom conditions,the bathrooms were filthy,,,
281222352,retail,negative,overabundance of stores,the number of stores outnumbered the rides 10 to 1,,,
281222352,atmosphere,negative,park feels commercial,I felt the park was one giant store just trying to get your money rather than a theme park for kids.,,,
281222352,characters,negative,difficult princess meet-and-greet queue,Waiting in line for a reservation to meet a princess was like competing in the Hunger Games.,,,
281222352,characters,negative,rare character sightings,I hardly saw any characters outside of the parade.,,,
281222352,attractions,negative,underwhelming studio park experience,The Walt Disney Studio was a complete waste of time.,,,
281222352,attractions,negative,"limited rides, long queues",It is so small with hardly any rides and the rides they do have were an hour wait.,,,
281222352,staff,negative,unresponsive guest services,when I complained to guest services they didn't bat an eye.,,,
281222352,recommendation,negative,discouraging park recommendation,I say skip Disney and go somewhere else.,,,
149989621,attractions,positive,many attractive ride experiences,so many attractive rides,,,
149989621,entertainment,positive,appealing shows,shows,,,
149989621,characters,positive,favorite characters appear,your favourite characters coming to see you,,,
149989621,entry/admission,negative,expensive steep price,even though you pay a steep price for it,,,
149989621,facilities,positive,restrooms were clean,restrooms were clean,,,
149989621,retail,positive,stores had variety,stores were so many & had so much variety,,,
149989621,atmosphere,positive,happy place,happy place,,,
149989621,timing,positive,good holiday place,good place to spend my holidays,,,
159060863,recommendation,positive,family recommendation,great place for families and kids,family,,
159060863,attractions,positive,worthwhile tour experience,also do the walk in walts steps tour a great worth for money,family,,
159060863,food/beverage,positive,diverse food choices,great food choices now to choose from,family,,
159060863,navigation,positive,convenient park proximity,great locations for all theme parks being close together to walk too,family,,
133249196,attractions,positive,minimal ride queue times,queuing didnt take long and didnt have to spend more than 15 minutes to get onto a ride,,,quiet period
133249196,characters,negative,character unavailability due strike,Disney Characters were on strike for 2 out of the 4 days we were there,,,quiet period
133249196,entertainment,negative,missed disney parade,missed the Disney parade,,,quiet period
569576817,attractions,positive,unique Ratatouille ride experience,"I recommend riding the Ratatouille ride several times, as there are different experiences based on what car you're in!",,,
569576817,retail,neutral,many shops available,There's lots of shops.,,,
569576817,attractions,negative,Pirates ride closed,The Pirates of the Caribbean ride was closed.,,,
569576817,recommendation,positive,specific ride recommendation,"I recommend riding the Ratatouille ride several times, as there are different experiences based on what car you're in!",,,
595435497,attractions,negative,frequent ride breakdowns,rides breaking down  on a regular basis,,No,
595435497,recommendation,negative,not recommend return visit,this is are second time and our last,,No,
595435497,staff,positive,great cast members,people great,,No,
595435497,timing,positive,favorable weather conditions,weather great,,No,
361825129,navigation,negative,park crowding impacts experience,It was very crowded,family,yes,4 day weekend
361825129,attractions,positive,completed most rides despite,we still managed to do just about all of the rides,family,yes,4 day weekend
361825129,characters,positive,son enjoyed cars characters,"He thoroughly enjoyed Radiator Springs, and all of the Cars characters",family,yes,4 day weekend
361825129,food/beverage,positive,allowed outside snacks,"We appreciate that Disney allows you to bring in your own snacks, rather than requiring you to buy food once you're in the park.",family,yes,4 day weekend
562193594,attractions,negative,limited ride selection,maybe 4 rides for people over the age of 7,family,,February
562193594,attractions,negative,excessive ride wait time,the waits for those rides were rediculous (1.5   2 hours),family,,February
562193594,attractions,negative,ride closure disappointment,Many of the rides were closed or broke down during our visit.,family,,February
562193594,attractions,negative,rides breaking down frequently,"again rides closed, long waits, rides breaking down left and right",family,,February
562193594,navigation,negative,excessive park crowding,way too many people!,family,,February
562193594,pre-visit,negative,insufficient park information,We should have been told more about the parks when we purchased the tickets or even when I called in advance to ask questions.,family,,February
562193594,attractions,negative,park unsuitable for older,"One park is primarily for little kids and the other, unless you pay for the Fastpass app and figure out how to use it quickly, don't waste your time or money going here.",family,,February
562193594,entry/admission,negative,full price medical ineligibility,"I personally cannot ride any rides due to medical issues, but still had to pay full price",family,,February
544917365,atmosphere,positive,wonderful Christmas celebration,What a wonderful place to celebrate the season.,family,,Christmas
544917365,entertainment,positive,enjoyable seasonal celebration,Really love California adventure celebrations too.,family,,Christmas
544917365,attractions,negative,jingle cruise unavailable,Was surprised to find out no jingle cruise this year.,family,,Christmas
544917365,attractions,positive,haunted mansion looks great,Haunted mansion looks great.,family,,Christmas
544917365,attractions,positive,small world celebration good,It   s a small world celebration is also looking good.,family,,Christmas
488663731,attractions,positive,manageable ride queue times,we didn't have to queue long for most rides,family,,
488663731,attractions,positive,easy magic hour access,the ones you did can be accessed easily in the magic hours,family,,
488663731,staff,positive,helpful and friendly staff,All staff very helpful and friendly,family,,
488663731,food/beverage,neutral,food priced as expected,food priced as expected,family,,
488663731,food/beverage,neutral,baby food availability,you can get limited choice of baby food in restaurants,family,,
488663731,food/beverage,positive,lunch with entertainment,good because there was entertainment on while you ate,family,,
488663731,food/beverage,positive,waitress service worth extra,worth the extra with waitress service,family,,
488663731,navigation,positive,easy park navigation,Easy to walk between the two parks and on site hotels,family,,
488663731,navigation,positive,well laid out park,well laid out,family,,
488663731,facilities,positive,felt safe,felt safe,family,,
129853153,timing,neutral,rainy weather impact,It was a good day out unfortunately a bit rainy but obviously that can't be helped.,,Unknown,May
129853153,atmosphere,positive,beautiful Main Street castle,Main Street & the castle look great,,Unknown,May
129853153,attractions,positive,minimal ride queue times,there weren't large queues for rides,,Unknown,May
129853153,attractions,negative,dark walk through dangerous,"Some walk through to the ride were really dark and it was hard to see, a bit dangerous.",,Unknown,May
129853153,attractions,negative,space mountain discomfort bruises,"Alot of really bad banging about on space mountain, really sore ears and we both have badly bruised shoulders.",,Unknown,May
129853153,staff,negative,unpleasant staff comparison,Some staff were a bit unpleasant but at the sale time I think we are spoiled having encountered the staff in Florida.,,Unknown,May
129853153,food/beverage,negative,expensive food snacks,The food and snacks were quite expensive,,Unknown,May
129853153,entertainment,positive,amazing night time show,"The best part of the day was the new night time show, it's amazing!!",,Unknown,May
129853153,entry/admission,negative,day out expensive,All together a good day out but a bit expensive.,,Unknown,May
129853153,recommendation,positive,positive visit recommendation,I would still recommend it!,,Unknown,May
437726393,comparison,neutral,smaller than other parks,This Disneyland is smaller than the others,,Unknown,
437726393,navigation,positive,walkable park layout,Not too far to walk around.,,Unknown,
437726393,attractions,positive,suitable rides for kids,Lots of rides suitable for young kids.,,Unknown,
437726393,attractions,positive,supervised ride operation,run and supervised.,,Unknown,
437726393,timing,positive,weekday visit avoids queues,Go early on weekday and you won't have to queue too long for the rides.,,Unknown,
437726393,timing,negative,avoid school holiday visits,Also avoid local and Chinese school holidays.,,Unknown,
437726393,recommendation,positive,two-day pass suggestion,"i would suggest you get a 2 day pass, so you can go on separate days.",,Unknown,
437726393,entry/admission,neutral,bag check upon entry,Bags are checked upon entry.,,Unknown,
437726393,food/beverage,neutral,dining options available,"There are plenty of dining options in the park, both Western and local foods",,Unknown,
437726393,food/beverage,negative,outside hot food restricted,"Outside food,e.g. hot food, sandwiches, is not allowed.",,Unknown,
437726393,food/beverage,positive,allowed snacks and water,Snacks and water are OK.,,Unknown,
229351023,recommendation,positive,enthusiastic return visit intention,"A great experience, one that I would definately do again.",family,Unknown,
229351023,characters,positive,Mickey Mouse dream fulfilled,Seeing Mickey Mouse was a dream come true for her.,family,Unknown,
229351023,attractions,positive,enjoyable ride experiences,The rides were pretty awesome also.,family,Unknown,
229351023,entertainment,positive,colorful parade floats costumes,We saw the day parade with the most colorful floats and costumes,family,Unknown,
229351023,entertainment,positive,spectacular evening fireworks show,also the fireworks show in the evening was spectacular.,family,Unknown,
229351023,timing,negative,avoid school holiday visits,"check that you're not going in school holidays, it was chaotic to say the least",family,Unknown,
229351023,attractions,negative,excessive ride queue times,some lines were an hour wait to go on a ride that lasted 1 minute.,family,Unknown,
229351023,attractions,positive,early morning ride strategy,We decided on the second day we would be there at opening to make the most of the quiteness.,family,Unknown,
226632538,entry/admission,neutral,tickets for both parks,"its worth getting tickets for both parks, this and Walt Disney Studios",,,summer
226632538,attractions,positive,great older park rides,"this is the older park, still has some great rides such as big thunder mountain and Space mountain",,,summer
226632538,attractions,neutral,completed many ride experiences,we did all of the rides (apart from Star Tours) some quite a few times!,,,summer
226632538,attractions,neutral,experienced classic tugboat ride,even got on the old tugboat.,,,summer
226632538,attractions,negative,Crushes Coaster no FastPass,"its a shame there is no fast pass for Crushes Coaster, as only managed to get on that one time",,,summer
226632538,entry/admission,positive,early entry benefit,we took advantage of the early opening for hotel guests (8am rather than 10am),,,summer
226632538,attractions,positive,enjoyable early morning rides,"we did get to go on Peter Pan's magic flight, the tea cups, Buzz Lightyear's Lazer Blast and there is nothing like Space Mountain just after 8am in the morning!",,,summer
226632538,food/beverage,positive,hotel half board benefit,if you are staying in a Disney Hotel take advantage of the half board option and book dinners in the various restaurants around the two parks,,,summer
226632538,food/beverage,positive,quality waiter service meals,three course meals with waiter service and not a burger in sight!,,,summer
226632538,food/beverage,positive,enjoyable restaurant experiences,"we went to the Silver Spur Steakhouse and Walt's American Diner, both very good.",,,summer
226632538,food/beverage,positive,calm dining environment,The Diner was an oasis of calm in a busy park,,,summer
226632538,food/beverage,positive,family friendly seating arrangements,"tended to seat families with young children in one part and with older children in another, which seemed to work well for everyone",,,summer
226632538,food/beverage,positive,beats fast food queues,it definitely beats queueing up for junk food in busy fast food palaces,,,summer
226632538,entertainment,positive,magical ending show,the show at the end was  pure Disney magic,,,summer
226632538,entertainment,positive,parades worth seeing,the parades are worth seeing !,,,summer
226632538,navigation,negative,summer park is busy,again the park is busy in the summer,,,summer
226632538,pre-visit,neutral,plan days accordingly,plan your days,,,summer
226632538,facilities,neutral,take raincoats,take raincoats!,,,summer
226632538,attractions,positive,utilize fast pass system,use the fast pass when you can!,,,summer
190459495,attractions,positive,numerous pleasing attractions,"The park is really big, with countless attractions, which will please not only kids, but adults also.",,,
190459495,attractions,positive,great fun rides,We had great fun in the rides,,,
190459495,entertainment,positive,enjoyable park shows,watching the shows,,,
190459495,attractions,positive,favorite attraction Mystic,My favourite attraction was the Mystic Manor,,,
616348932,attractions,positive,enjoyable ride selection,A handful of good rides for adults makes it enjoyable.,family,Unknown,
616348932,atmosphere,positive,fantastic themed detail,The layout of the park and the themed detail that goes into the attraction is fantastic.,family,Unknown,
616348932,navigation,positive,easy park navigation,A one day pass is all that is needed to get around to all the attractions.,family,Unknown,
616348932,food/beverage,negative,limited food stall availability,Only disappointment was the lack of food stalls,family,Unknown,
616348932,food/beverage,negative,poor food stall variety,and the lack of variety. Many stalls were closed.,family,Unknown,
616348932,food/beverage,negative,unfresh food quality,Kids had hotdogs which did not seem fresh.,family,Unknown,
616348932,entertainment,positive,fantastic parade experience,The 1.30pm parade was fantastic and a must see for all ages.,family,Unknown,
186049752,comparison,neutral,smaller than other parks,This Disney is tiny compared to Disney World and the Paris Disneyland,friends,Unknown,
186049752,characters,positive,cute and friendly characters,The characters were super cute and friendly as they always are in Disney Land,friends,Unknown,
186049752,attractions,neutral,less thrilling rides,"The rides aren't really thrill seeking rides, but some are fun non the less so don't pass on any rides just because they don't look like you'll have fun because even the sit down walk through rides are great to expereince.",friends,Unknown,
529217032,entry/admission,negative,excessive ticket cost,spend the better part of $200 to walk thru the gate,,,
529217032,attractions,negative,lengthy ride queues,stand in line all dang day to get on just 3 4 rides!!!,,,
529217032,food/beverage,negative,excessive food pricing,The cost of food is ridiculous!!!!,,,
529217032,cleanliness,neutral,attempts at park upkeep,They do try to maintain park cleanliness but it's difficult.,,,
529217032,entry/admission,negative,park visit money grab,It is just a total money grab by the Disney Corp.,,,
529217032,navigation,negative,park crowding despite promises,"They claimed they raised prices to cut down on crowds but they know DARN WELL people will still go, and they will take their kids and grand kids.",,,
529217032,navigation,negative,no enforced crowd limits,The only way to limit crowds is to LIMIT CROWDS. Find a maximum number and then close the gates!!!,,,
529217032,navigation,negative,excessive picture line waits,after standing in a ridiculous line of course!,,,
426548718,atmosphere,positive,park has vibrant atmosphere,This place is very lively.,,,
426548718,attractions,positive,enjoyable ride experiences,The rides out here are good.,,,
426548718,entertainment,positive,highly recommend parade viewing,Any one going here must wait till the end to watch the parade. It is too good.,,,
324162350,entertainment,positive,fantastic castle firework show,"It's fantastic, so beautyful.",,,
134138344,recommendation,positive,recommend annual passport purchase,If you live in Southern California I do recommend getting an annual passport.,,No,Summer
