review_id,touchpoint,sentiment,code,text_excerpt,travel_party,first_visit,visit_timing
284776244,comparison,negative,cleanliness expectations unmet,spoiled by the cleanliness of WDW as we were a little disappointed to find litter and weeds in the landscaping,,,
284776244,cleanliness,negative,litter and weeds present,litter and weeds in the landscaping and on the walkways,,,
79588178,attractions,negative,excessive ride breakdown frequency,we were really surprised at the amount of rides that were down due to technical problems,family,No,
79588178,attractions,negative,ride closure disappointment,Space Mountain was closed down for an entire day,family,No,
79588178,attractions,neutral,park under construction,California Adventure is undergoing a major renovation   half the park is under construction,family,No,
79588178,entertainment,positive,amazing show worth wait,The World of Color is amazing and well worth the wait to see,family,No,
79588178,entertainment,neutral,standing-only show seating,Be aware that there are no seats for this show   you will be standing for the entire show.,family,No,
79588178,attractions,positive,minimal ride queue times,able to ride everything we wanted with a minimal wait thanks to the fastpass system,family,No,
79588178,food/beverage,negative,excessive food pricing,Be careful of food prices   it is really expensive to eat inside the park.,family,No,
399989706,attractions,negative,ride closures disappointment,A little disappointed on the ride closures as they are updating the park,,,
399989706,attractions,negative,poor ride closure timing,never a good time to do this when its opened all year round!,,,
399989706,pre-visit,negative,check ride availability,Strongly advise you check before booking or telling the kids what rides they can go on just in case they are closed.,,,
399989706,attractions,positive,plenty of ride choices,Plenty of different rides.,,,
464761511,comparison,positive,positive Disney World experiences,I've been to Disney World multiple times and it's always been a great experience.,,No,
464761511,general,negative,disappointed overall experience,I have to say I was very disappointed with the experience.,,No,
464761511,attractions,negative,numerous ride closures,My first complaint would be the number of rides that were closed during our visit.,,No,
464761511,attractions,negative,short notice ride closures,Disney will often release ride closures on very short notice.,,No,
464761511,attractions,negative,ride closures aggravating,This was especially aggravating as these were the 2 rides that were different than Disney World that we wanted to experience.,,No,
464761511,attractions,negative,multiple temporary ride closures,In addition to the ride closures we also experienced multiple unexpected temporary ride closures.,,No,
464761511,attractions,negative,ride broken down,We were in line 3 times where the ride broke down and they had to shut the rides down temporarily.,,No,
464761511,attractions,negative,monorail broken,Even the monorail was broken when we tried to ride that.,,No,
464761511,navigation,negative,unexpectedly crowded park,The crowds were also a problem. We went during what was expected to be one of the slowest weeks of the year for the park and it was still quite crowded.,,No,
464761511,attractions,negative,long attraction lines,Lines were often long for the attractions.,,No,
464761511,comparison,positive,better Disney World experiences,Perhaps we were lucky on our previous trips to Disney World but we never experienced these problems before,,No,
464761511,comparison,negative,Disney World preferred,In the future we'll be sticking to the Florida parks.,,No,
471893804,timing,neutral,spring break visit,We went during spring break,family,,spring
471893804,attractions,positive,manageable ride queue times,never stood in line for more than 40 min,family,,spring
471893804,attractions,positive,entertaining queue experience,Disneyland is the master of lines keeping you entertained while making them look small,family,,spring
471893804,pre-visit,positive,Disneyland app is essential,"The three things you will NEED is the park hopper pass, Disneyland app and your phone with data.",family,,spring
471893804,pre-visit,positive,app shows important information,"The app show closed attractions, washrooms, length of lines, fast pass times and where and when Characters can be found.",family,,spring
471893804,attractions,positive,FastPass avoids long queues,Fast passes will ensure you do not spend your vacation standing in lines.,family,,spring
471893804,attractions,positive,efficient FastPass strategy,We had our older son who would run ahead and get our fast pass then we would go to the other park and get a fast pass there.,family,,spring
471893804,facilities,positive,stroller rental is helpful,We rented strollers for the two little girl's 6 and under. This is a must because you cover a lot of ground in a day.,family,,spring
471893804,facilities,neutral,left items in stroller,We left all our stuff in the strollers and never had any issues until the last night when someone grabbed the wrong stroller after the fireworks.,family,,spring
471893804,facilities,positive,replaced lost souvenir cup,Disneyland did replace the cup free of charge which was fantastic.,family,,spring
471893804,entry/admission,negative,expensive with dollar exchange,This trip can be expensive with the dollar exchange,family,,spring
471893804,recommendation,positive,recommendation for families,but is a must for families.,family,,spring
471893804,recommendation,positive,recommendation age is ideal,My recommendation would be to take kids when they are between 6 an 10 as they can ride almost any ride and they really appreciated the magic of the park.,family,,spring
564833278,attractions,positive,enjoyable classic rides experience,"they enjoyed snow white, dumbo, its a small world, teacups",family,Unknown,
564833278,characters,positive,character breakfast recommendation,a must for any visit if you can is to attend Breakfast with the characters,family,Unknown,
564833278,characters,positive,queuing time saving,that saves some time in queuing up to see them,family,Unknown,
564833278,food/beverage,positive,great buffet breakfast,it is also a great american buffet breakfast as well,family,Unknown,
564833278,characters,neutral,character meet and greet,"we met Mckey, Donald, Daisy, Tigger, Eoi,Dr",family,Unknown,
564833278,entry/admission,positive,early park access benefit,Staying at a disney hotel we was able to enter the park at 8am,family,Unknown,
564833278,entertainment,positive,enjoyable parade experience,but the parade at 5pm was great as well,family,Unknown,
564833278,timing,neutral,conditional visit timing preference,if we were to go again we would definately go when it was a bit warmer,family,Unknown,
120925981,entertainment,positive,fireworks viewing location tip,"For the evening fireworks go to it's a smaal world, it's less crowded you can still hear the music and have a great view of the fireworks (excluding the 3 4 they set off from the castle) and afterwards they make it snow on the crowd. Very magical.",,,Christmas
120925981,atmosphere,positive,magical snow effect,afterwards they make it snow on the crowd. Very magical.,,,Christmas
120925981,atmosphere,positive,excellent christmas theming,"You cant beat Disneyland for it's Christmas efforts, re theming rides, decorations, parade, fireworks, it was all very good.",,,Christmas
120925981,comparison,negative,crowded than magic kingdom,"compared to Magic Kingdom at Disney World, and pretty much every park I've ever been to it is very, very, very crowded.",,,Christmas
120925981,navigation,negative,insufficient path width,the main paths from area to area aren't big enough or if they are are taken up by stroller parking (especially Tomorrowland).,,,Christmas
120925981,attractions,neutral,roger rabbit ride wait,"longest wait I did was 40 mins for the roger rabbit ride as i made good use of fastpass, but if you didnt use the fastpass then some rides were 65 70 mins.",,,Christmas
120925981,attractions,neutral,fastpass usage mentioned,as i made good use of fastpass,,,Christmas
120925981,attractions,negative,long stand-by ride queues,if you didnt use the fastpass then some rides were 65 70 mins,,,Christmas
120925981,food/beverage,negative,expensive theme park food,Food & drink was very expensive even for a theme park.,,,Christmas
120925981,food/beverage,negative,overpriced pizza slice,One slice of pizza cost me $7.,,,Christmas
423248287,comparison,positive,smaller park welcome change,"Loved this small Disneyland park. From someone who is a frequent visitor to WDW in Florida (which is HUGE), this small park was a welcome change.",,Unknown,
423248287,cleanliness,positive,"beautifully landscaped, clean","This is a beautifully landscaped, clean park.",,Unknown,
423248287,attractions,positive,short ride lines,The ride lines were short when we were there,,Unknown,
423248287,attractions,positive,enjoyable unique ride,we enjoyed riding a couple rides (such as Mystic Manor) that are unique to HK Disneyland,,Unknown,
423248287,food/beverage,negative,limited quick service options,My only complaint is there could be more quick service restaurants with more  western  food.,,Unknown,
423248287,food/beverage,negative,challenging food finding,Trying to find food other than snacks in the park was very challenging.,,Unknown,
423248287,recommendation,positive,future park visit,I would love to return to HK to spend more time and in doing so would return to HK Disneyland.,,Unknown,
423248287,atmosphere,positive,"friendly people, western friendly","Hong Kong on the whole is a beautiful place, the people are friendly and it is very much western friendly with most people speaking English.",,Unknown,
423248287,timing,neutral,visit heat impacted,it was nice to stay at the hotel when the heat was the worst,,Unknown,
640133477,attractions,positive,enjoyable ride experience,Rides were good,family,,
640133477,attractions,negative,requires patience for rides,need a lot of patience,family,,
640133477,attractions,negative,long ride wait time,waited an average of 40 minutes ride,family,,
640133477,food/beverage,negative,long coffee queue,Waited 20 mins to get coffee,family,,
640133477,food/beverage,negative,long food queue,35 mins to get a bite to eat,family,,
640133477,entry/admission,negative,poor value for money,Poor value for money,family,,
640133477,navigation,negative,poor organisation,poor organisation by Disney,family,,
640133477,timing,negative,dread peak period visit,Dread to think what it is like in peak periods.,family,,
329990097,attractions,positive,thrilling rides accessible,younger children can go on the more thrilling rides,family,Unknown,Chinese public holiday or weekend
329990097,attractions,neutral,height and weight limitations,"There are some limitations in height and weight, so some of you taller or heavier folk may have challenges.",family,Unknown,Chinese public holiday or weekend
329990097,food/beverage,negative,limited vegetarian options,We struggled to find vegetrian food,family,Unknown,Chinese public holiday or weekend
329990097,food/beverage,positive,main street diner choice,but the Main Street diner had the widest choice,family,Unknown,Chinese public holiday or weekend
329990097,navigation,neutral,relatively small park size,"The park is relatively small, on par with the UK theme parks",family,Unknown,Chinese public holiday or weekend
329990097,timing,positive,quieter day one ticket,so on a quiter dat only on dat is needed.,family,Unknown,Chinese public holiday or weekend
329990097,entry/admission,neutral,two day ticket busy,If you go on a busier day (Chinese public holiday or weekend) it may be worth considering a two day ticket.,family,Unknown,Chinese public holiday or weekend
329990097,entertainment,positive,catch the parades,"Catch the parades, they are fun",family,Unknown,Chinese public holiday or weekend
329990097,entertainment,positive,stay late fireworks,stay late for the fireworks,family,Unknown,Chinese public holiday or weekend
329990097,navigation,negative,mtr post fireworks crowding,so it will be busy on the MTR.,family,Unknown,Chinese public holiday or weekend
142306132,atmosphere,positive,overall magical atmosphere,MAGICAL,,,
142306132,entertainment,positive,amazing firework show,Firework show is the best out there.,,,
130157792,attractions,neutral,acknowledges ride queues,you have to wait,,,
130157792,entry/admission,negative,expensive park admission,it isn't cheap,,,
83146163,recommendation,positive,exceeded visit expectations,Disneyland Park in Los Angeles exceeded my expectation where everyone were telling me that it doesn't worth the visit. But what I saw is completely different,,,
173372421,cleanliness,positive,park kept clean,The park is still clean,,No,past week
173372421,atmosphere,positive,beautiful landscaping,the landscaping is beautiful once you get in the gates,,No,past week
173372421,attractions,positive,magic morning benefits,"This enabled us to ride all the attractions early in the day, get fast passes, and not feel the rush of the crowds.",,No,past week
173372421,staff,negative,less friendly cast members,the cast members smile a little less,,No,past week
173372421,staff,negative,inconsistent rule application,at times we found they don't know the rules so apply them inconsistently.,,No,past week
173372421,entry/admission,negative,difficult gate entry process,Getting through the gate can be a hassle unless you have a Season Pass.,,No,past week
173372421,entry/admission,neutral,multi-day pass verification,Multi day passes are scanned first by a person at the outside gate.,,No,past week
173372421,entry/admission,neutral,mandatory bag check process,Before all of this you must go through the bag check line whether you have a bag or not.,,No,past week
173372421,entry/admission,negative,inefficient security queue system,a separate line for those without bags to no avail.,,No,past week
173372421,food/beverage,neutral,prepare for high costs,"Be prepared to spend money for food, tickets, drinks, etc.",,No,past week
225318058,atmosphere,negative,park feels a bit tired,but overall the park is a bit tired.,,Unknown,
225318058,food/beverage,negative,average and junky food,Food was average and junky,,Unknown,
225318058,food/beverage,negative,unhealthy food unavailable,nothing healthy was available which was unfortunate.,,Unknown,
225318058,food/beverage,negative,overpriced poor quality food,After    24 for a poorer version of McDonalds we felt robbed and slightly worse for wear.,,Unknown,
225318058,attractions,negative,flawed fast pass system,"Fast pass idea is flawed, we went to space mountain to get a fast pass and the fast pass line looked just as long as the regular line.",,Unknown,
225318058,attractions,negative,lengthy ratatouille ride queue,"Queuing was 90 minutes at the ratatouille ride, and we were informed that fast passes were no longer available, so had to go without.",,Unknown,
225318058,staff,negative,unhappy staff interactions,"We did not come across any staff who looked pleased to be at work, except for the dancers in the Main Street USA area.",,Unknown,
225318058,staff,negative,unhelpful food stall staff,"Staff operating the food stalls especially were unhelpful and snooty, which brought down the happy and cheery Disney experience.",,Unknown,
225318058,recommendation,positive,recommend buying tickets,"Thoroughly recommend buying tickets to both parks which we did upon recommendation by our hotel, there is not enough to do in either park alone.",,Unknown,
225318058,comparison,negative,disappointed by Paris version,"Had a great time at Disneyland in Los Angeles a few years ago, but was sadly disappointed by Paris's version.",,Unknown,
225318058,recommendation,negative,would not come back,Would not come back,,Unknown,
151646592,recommendation,positive,must-visit family recommendation,One of the MUST visited place especially for family,family,,
151646592,atmosphere,positive,fun and exciting atmosphere,You and your family would definitely have great fun surrounded with excitement,family,,
151646592,cleanliness,positive,park is very clean,The park is very clean,family,,
311982783,atmosphere,positive,youthful nostalgic feeling,makes you feel like a young kid again :),couple,Unknown,
311982783,retail,positive,desire to purchase merchandise,i would have bought half the shops found inside the park,couple,Unknown,
311982783,entertainment,positive,loved the parade show,i loved the parade at 5:30pm and the disney dreams show,couple,Unknown,
311982783,attractions,positive,amazing ride experience,the rides were amazing,couple,Unknown,
311982783,attractions,positive,enjoyable buzz lightyear ride,buzz lightyear laser,couple,Unknown,
311982783,attractions,positive,enjoyable thunder mountain ride,big thunder mountain were two of the best rides from both parks,couple,Unknown,
311982783,navigation,neutral,easy park access train,used the RER train which left from Val d'Europe and stops just outside Disney ( 1 stop),couple,Unknown,
373256571,staff,negative,unfriendly staff interactions,the staff it self not really friendly,solo,Yes,
373256571,comparison,negative,unimpressed compared to parks,"compare to other Theme park i went, i am sorry that i'm not impress",solo,Yes,
373256571,characters,negative,long character meet queues,there would be long line due to lack of Disney characters,solo,Yes,
373256571,attractions,negative,small park size,The park itself not really big,solo,Yes,
134214081,retail,negative,expensive straw hat purchase,feel like we paid 150 euros for 2 straw hats,,,
134214081,entertainment,neutral,enjoyable show food,only bit of the show food that was enjoyable,,,
134214081,entertainment,negative,cattle-like pre-show waiting,"just bunched together like cattle for an hour, in not a very large space",,,
134214081,entertainment,neutral,pre-show bar availability,but oh yes the bar was there for you to BUY drinks,,,
134214081,entertainment,negative,unwanted pre-show drinks,NO ONE WAS INTERESTED,,,
134214081,entertainment,negative,crowded seating arrangement,Once in arena shovelled into rows of people.,,,
134214081,food/beverage,negative,difficult dark food service,"Food was then served as show was in progress, some of the time in very dark lighting",,,
134214081,food/beverage,negative,inedible food quality,you couldn't really see what you were eating,,,
134214081,entertainment,negative,show and food conflict,"show was going on so what did you focus on, bad food, bad show???",,,
134214081,food/beverage,negative,waste of food,"And what a waste of food, how ever BAD.",,,
134214081,entertainment,negative,disappointing show experience,the show isn't really worth it,,,
134214081,food/beverage,negative,appalling food quality,and the food is appalling,,,
134214081,recommendation,negative,show not recommended,Would not reccommend this show at all.,,,
134214081,attractions,neutral,park requires queueing,it's fine if you like queueing,,,
134214081,attractions,positive,impressive park structures,amazing structures,,,
134214081,navigation,positive,lots to see,and lots to see,,,
134214081,recommendation,negative,expensive show not worth,please don't waste 75 euros per person on the Wild West Show.,,,
198668807,general,positive,consistently enjoyable experience,This is our third time going to Disneyland and it was just as enjoyable as our last.,family,no,spring break
198668807,general,positive,multiple days never boring,"We have gone for five full days every time that we visit, and have never ran out of things to do between Disneyland park and the California Adventure Park.",family,no,spring break
198668807,attractions,positive,less spring break crowding,"Even though it was spring break, the park was much less crowded than we expected and we were able to see everything that we wanted to see!",family,no,spring break
198668807,attractions,positive,reasonable attraction wait times,did not have to wait any more than 45 minutes in any of the single lines.,family,no,spring break
198668807,entry/admission,positive,early park entry advantage,Try to get there before the park officially opens.,family,no,spring break
198668807,retail,neutral,browsing main street shops,"Main Street opens half an hour before the rest of the park, and you can spend some of the time browsing shops",family,no,spring break
198668807,food/beverage,neutral,quick bite on main,or having a quick bite to eat while waiting,family,no,spring break
198668807,attractions,neutral,popular ride examples,"some attractions at Disneyland park with the biggest line ups are Indiana Jones, Splash Mountain, Space Mountain, the Matterhorn and Big Thunder Mountain",family,no,spring break
198668807,attractions,positive,efficient fastpass system,Fastpass is a great system that is available at a few of the biggest attractions in Disneyland and California Adventure park.,family,no,spring break
198668807,attractions,positive,minimal fastpass queue times,"When you do return, you're admitted into a separate entrance that usually has no more than a 10 15 minute wait",family,no,spring break
198668807,attractions,negative,long standby queue times,even when the Standby line can be over an hour and a half!,family,no,spring break
198668807,entertainment,neutral,frontierland golden horseshoe show,The Golden Horseshoe in Frontierland has 15 minute shows than run every hour in the afternoon,family,no,spring break
198668807,food/beverage,neutral,grabbing snack golden horseshoe,and it is a fun place to grab a snack and get out of the sun for a while.,family,no,spring break
198668807,entertainment,positive,air conditioned tiki room,Other show to watch is the Tiki Room in Adventureland (Nice and Air conditioned,family,no,spring break
198668807,food/beverage,neutral,dole whip outside tiki,they sell pineapple dole whip and floats right outside,family,no,spring break
198668807,entertainment,positive,enjoyable tiki room air,we enjoy the air conditioning so much that we still go every time!,family,no,spring break
198668807,entertainment,neutral,afternoon riverboat and lair,Other good options for the afternoon are the Mark Twain Riverboat or the Pirate's Lair in Frontierland,family,no,spring break
198668807,navigation,neutral,main street streetcars shows,Main Street attractions (they have street cars you can ride on and a few shows to see as well,family,no,spring break
198668807,attractions,neutral,high capacity ride afternoon,"Pirates of the Caribbean and the Haunted Mansion are good as well for the afternoon, because these attractions hold so many people at one time that even if the line is long, it goes really fast.",family,no,spring break
198668807,attractions,positive,efficient late night queues,The line also seems to go much faster after the park closes too.,family,no,spring break
198668807,attractions,neutral,popular ride closing queue,"if there is a ride that is always lined up (like the Matterhorn or Space Mountain), you can get in line right before the park closes, and as long as you're in line before then you will still get on.",family,no,spring break
198668807,attractions,negative,packed fantasyland afternoon,"Stay clear of it in the afternoon! This place is always packed, and since the rides do not hold many people you can be waiting for over 2 hours for some of the attractions.",family,no,spring break
198668807,attractions,neutral,hidden fantasyland queue lengths,"Also, the lines can be tick you. They may not look long, when in reality the wind many times and go through tunnels.",family,no,spring break
198668807,attractions,neutral,check ride estimated times,So make sure you check the sign at the front of the attraction for the estimated wait time.,family,no,spring break
198668807,food/beverage,positive,improved food selection,We were also very pleased with the food selection this time (has improved a lot since the last time we visited).,family,no,spring break
198668807,food/beverage,neutral,shrimp salad stuffed potato,Some of our favourites were the shrimp salad stuffed potato at the Harbor Galley,family,no,spring break
198668807,food/beverage,neutral,clam chowder around park,"the Clam Chowder that can be found around the park, and the Hungry Bear Restaurant in Critter Country.",family,no,spring break
198668807,food/beverage,neutral,red rocket's pizza pasta,"If your looking for pizza or pasta, go to Red Rocket's Pizza Port in Tomorrowland.",family,no,spring break
198668807,food/beverage,neutral,blue bayou finer dining,"If you want finer dining, try the Blue Bayou.",family,no,spring break
198668807,food/beverage,positive,blue bayou trip highlight,We finally treated ourselves to this restaurant and it became the highlight of our trip.,family,no,spring break
198668807,atmosphere,positive,pirates themed dining,"The restaurant sits in the Pirates of the Carribean restaurant, so you get to watch the boats go by as you eat.",family,no,spring break
198668807,food/beverage,positive,great food excellent service,"Also, the food was great and the service was awesome!",family,no,spring break
198668807,general,positive,disneyland charming experience,"remember that Disneyland is not a park for thrill rides, but for it's charm and experience, you will have a great time!",family,no,spring break
198668807,recommendation,positive,disneyland enjoyment for all,I truly believe that Disneyland is for everyone!,family,no,spring break
138153677,attractions,positive,beneficial FastPass system,Fast Passes are the way to go.,family,Unknown,
138153677,attractions,positive,efficient ride access,"Get a fast pass, go to another ride, go back to the fast pass ride. It was so easy.",family,Unknown,
138153677,entertainment,negative,inconvenient fireworks seating change,we sat and waited for the fireworks show and were told 25 min before they started that we had to stand and make room for those who didn't.,family,Unknown,
