review_id,touchpoint,sentiment,code,text_excerpt,travel_party,first_visit,visit_timing
289961005,comparison,negative,cheaper smaller version,it felt like a cheaper and smaller version of its American counterparts,family,Yes,July
289961005,recommendation,positive,great place to visit,if you are looking for a great and rather magical place to take the kids that's a short distance from the UK then Disneyland is your place,family,Yes,July
289961005,facilities,negative,uneven ground dangerous,"the ground uneven and many  juts  in the paving were rather dangerous, the paving is not always flush and park management need to consider this",family,Yes,July
289961005,attractions,positive,quick ride access,I did appreciate the quick access on to various rides,family,Yes,July
289961005,staff,positive,considerate respectful staff,I found all staff at the rides to be considerate and respectful of my condition.,family,Yes,July
289961005,staff,negative,public glared wheelchair,we were glared at when we were supposed to be in the  Happiest Place in the World  just because we were getting on to a ride in front of them.,family,Yes,July
289961005,staff,positive,fantastic staff job,I found the huge majority of staff to be fantastic at their job,family,Yes,July
289961005,staff,positive,entertaining lift operator,the lift operator in the Tower of Terror! My husband and kids thought he played the part well and they were very impressed with his range of languages and drama skills!,family,Yes,July
289961005,entertainment,positive,memorable frozen performance,"the dancers in the Frozen Sing a Long made it a fantastic and memorable performance for my 7 year old, she was just in awe and was made to feel special.",family,Yes,July
289961005,staff,negative,unfriendly staff member,I only experienced one member of staff of whom I would consider as not very friendly though perhaps she was just having a challenging day!,family,Yes,July
289961005,retail,negative,shopping repetitive selection,"Shopping wise, its all a bit repetitive, there are no beanie hats and there is just not the selection of goods like you would find in the American resort parks",family,Yes,July
289961005,retail,positive,something for everyone,though there is something for everyone and you will easily find a gift or two to take home,family,Yes,July
289961005,retail,positive,quirky gifts available,there are some lovely quirky gifts to be had,family,Yes,July
289961005,retail,negative,shopping can pricey,some can be rather pricey too!,family,Yes,July
289961005,food/beverage,negative,restaurants kiosks closed,"we found many of the restaurants or kiosks were closed, and during a particularly hot spell at the start of the holidays (early July) this was challenging",family,Yes,July
289961005,food/beverage,negative,expensive disney food,we found the food to be typically Disney expensive,family,Yes,July
289961005,cleanliness,negative,toilets not clean,we found the toilets were not that clean,family,Yes,July
289961005,food/beverage,positive,enjoyed pizza outpost,we enjoyed Pizza in Colonel Hathi's Pizza Outpost,family,Yes,July
289961005,food/beverage,positive,lush biscuits main,the mickey shaped French sable biscuits on Main Street were just lush!,family,Yes,July
289961005,comparison,negative,three out five,when compared to its American counterparts I would rate this place a three out of five,family,Yes,July
289961005,recommendation,positive,magic for kids,"the whole magic of Disney for the kids and adults alike, I would rate Disneyland Paris as a four out of five.",family,Yes,July
374695583,timing,positive,arrive at park opening,Get to the park at opening.,friends,No,
374695583,attractions,positive,short ride queues early,"Hit the busiest rides first, before they get too crowded...Space Mountain, Big Thunder Mountain Railroad, Indiana Jones, etc.",friends,No,
374695583,attractions,positive,efficient single rider passes,Utilize single rider passes!,friends,No,
374695583,attractions,positive,avoid wasting hours,without wasting hours in line,friends,No,
374695583,attractions,positive,fast pass ride access,"Get Fast Passes for the rides you can't do Single Rider (or don't want to separate on)...Splash Mountain, Big Thunder Mountain, Tower of Terror...",friends,No,
374695583,food/beverage,positive,enjoyable blue bayou dining,Blue Bayou is a fun option for lunch or dinner,friends,No,
390457519,general,positive,overall park satisfaction,Excellent,,,
390457519,general,positive,consistent park experience,Never disappoint,,,
390457519,food/beverage,positive,highly rated restaurant,blue bayou restaurant is 5 stars,,,
390457519,food/beverage,negative,expensive dining experience,although pricey,,,
390457519,attractions,positive,effective FastPass system,fast pass worked well for us,,,
390457519,food/beverage,neutral,outside food allowed,u may bring your own food and drinks inside,,,
195517801,atmosphere,positive,"fun day, Mickey ears",We had a fun day wearing Mickey ears and being able to be big kids for a day.,friends,Unknown,January
195517801,comparison,positive,"great copy, original Disneyland",I have been to Disneyland Anaheim and this is a great copy of the original.,friends,Unknown,January
195517801,entertainment,positive,wonderful parade entertainment,The parade was wonderful,friends,Unknown,January
195517801,entertainment,positive,spectacular lion king show,and the lion king show spectualar.,friends,Unknown,January
195517801,comparison,negative,original park experience better,I still had that wonderful Disney feeling but it wasn't as good as the original.,friends,Unknown,January
195517801,recommendation,positive,strongly advise to go,I would still strongly advise to go for at least 1 day.,friends,Unknown,January
195517801,staff,positive,great customer service,The customer service was great,friends,Unknown,January
195517801,atmosphere,positive,excellent park atmosphere,and the atmosphere was excellent.,friends,Unknown,January
237426039,timing,neutral,early July visit timing,early July,family,Unknown,July
237426039,attractions,negative,queues starting to form,queues we starting to form,family,Unknown,July
237426039,food/beverage,negative,very expensive food,We found the food very expensive both on the small stalls and in the restaurants,family,Unknown,July
237426039,entertainment,positive,brilliant well thought shows,the show's were very brilliant well though out,family,Unknown,July
237426039,attractions,negative,rides closed due rain,some of the rides were closed for a time understandable for safety reasons,family,Unknown,July
237426039,entry/admission,negative,entry fee expensive,entry fee is expensive,family,Unknown,July
237426039,entertainment,positive,fantastic light parade,The parade of light at night is fantastic,family,Unknown,July
237426039,recommendation,positive,willing to return,we will be going back again just hope the weather is better,family,Unknown,July
449804083,characters,neutral,daughter's desire to meet,It was my 6 yrs old daughter's dream to meet her favorite Disney stars.,family,Unknown,Unknown
449804083,pre-visit,positive,discounted ticket purchase,We booked Disneyland tickets via Klook a month in advance and availed good discounts!,family,Unknown,Unknown
449804083,navigation,neutral,easy park access,Reaching Disneyland is so very easy...,family,Unknown,Unknown
449804083,navigation,neutral,convenient Disney line,change for Disney Resort Line at Sunny Bay Station.,family,Unknown,Unknown
449804083,navigation,neutral,themed train experience,The Disney Resort Line is a themed MTR train with Mickey Mouse shaped windows and comfortable sofas.,family,Unknown,Unknown
449804083,entry/admission,negative,queue before opening,The queue starts almost 1 hour before park opening.,family,Unknown,Unknown
449804083,entry/admission,neutral,voucher to tickets conversion,Your vouchers are converted to regular tickets only through the entrance.,family,Unknown,Unknown
449804083,navigation,neutral,park size small,Being a small park it can be seen back to front in nearly 5 hours.,family,Unknown,Unknown
449804083,navigation,negative,long walking distance,Wear comfortable shoes as you have to walk a lot and stand in long queues at times.,family,Unknown,Unknown
449804083,attractions,neutral,queues will be shorter,queues will be shorter.,family,Unknown,Unknown
449804083,characters,negative,long character meet queue,However with a 6 year old dying to meet her favorite characters i too didnt have a choice but to add to the queue :),family,Unknown,Unknown
449804083,food/beverage,neutral,allowed snacks and water,Light snacks were allowed without any fuss inside the park. Own water and juice was allowed too.,family,Unknown,Unknown
449804083,staff,positive,helpful and courteous staff,The staff was very helpful and courteous.,family,Unknown,Unknown
449804083,facilities,positive,good free WIFI service,The free WIFI service inside the park was good enough for us to share our memories in real time.,family,Unknown,Unknown
449804083,characters,neutral,check meet greet times,Ensure to check out the time and place of the meet & greet of all the Disney characters from the guide map available in the park's entrance.,family,Unknown,Unknown
449804083,food/beverage,negative,unattractive restaurant food,The food at the restaurants wasn't too attractive or delicious however we still had a heavy meal to stay active until the fireworks.,family,Unknown,Unknown
449804083,entertainment,neutral,staying till shows,So we grabbed the best seats on the benches right in front of the Sleeping Beauty Castle.,family,Unknown,Unknown
449804083,facilities,neutral,carry warm clothes,Even though the weather looks pleasant ensure to carry warm clothes during winters as staying out in open for the shows can give you a wind chill effect.,family,Unknown,Unknown
449804083,entry/admission,positive,sufficient one day ticket,I personally found the oe day ticket to be good enough as we with planning we covered everything and enjoyed nearly 99% of the attractions.,family,Unknown,Unknown
449804083,attractions,positive,effective fast pass,"I used the fast pass for Space Mountain and one more ride and it worked like a charm, no long queues :)",family,Unknown,Unknown
449804083,retail,negative,selfie sticks issue,"Though everyone says DON'T BRING SELFIE STICK which i even confirmed with Disneyland team, i could still see a lot of guests with these sticks inside the park.",family,Unknown,Unknown
449804083,characters,positive,character autograph suggestion,As suggested by someone here i took an autograph book and got many characters happily sign it.,family,Unknown,Unknown
449804083,entertainment,neutral,capture every moment,Keep enough space and charge on your cameras phones for videos and pictures until the fireworks as you would love to capture every moment for a lifetime.,family,Unknown,Unknown
449804083,recommendation,positive,Disneyland must visit,Disneyland is must visit for people of all age.,family,Unknown,Unknown
449804083,attractions,positive,enjoyed the carousel,My wife and i enjoyed the Cinderella Carousel like kids...,family,Unknown,Unknown
192803325,characters,positive,princess meet and greet,met her favorite princesses,,,
192803325,staff,positive,friendly staff,friendly staff,,,
385363357,characters,negative,character absence disappointment,I did not see one disney character besides Woody from Toy Story. it did not feel like Disney at all.,,,
385363357,attractions,negative,lengthy ride queues,Every ride has at least a 30 minute wait.,,,
385363357,attractions,negative,excessive ride breakdown frequency,We actually waited for 2:37 minutes for Space Mountain because the ride broke twice while we were in line.,,,
385363357,attractions,negative,unaccomodating ride breakdown,They did not do anything to accommodate waiting for their premier ride that broke twice on us.,,,
385363357,food/beverage,positive,reasonable food pricing,The best part of the experience is that they did not rip you off on the food prices.,,,
385363357,recommendation,negative,unlikely park return,I do not see any circumstance that I will return.,,,
385363357,comparison,positive,prefers disney world experience,I would much rather go to Disney World as it is much bigger and better for adults.,,,
169472716,attractions,negative,super long ride queues,super looong queues,,,
169472716,attractions,negative,shabby ride equipment,some shabby equipment,,,
169472716,attractions,negative,long ride queues,long queues,,,
169472716,attractions,negative,excessive ride queue wait,"ultra long queues to the most popular and interesting attractions, where the ETA was exceeding 1 hour crazy!!",,,
169472716,attractions,negative,ride closures impacted experience,some attractions were not operational,,,
169472716,attractions,negative,ride visible wear,some had visible signs of wear and shabbiness,,,
169472716,entry/admission,negative,park ticket expensive,it's pretty expensive.,,,
284489117,attractions,negative,long ride queue times,"Lots of standing in line for rides, even with the ticket system.",family,,
284489117,timing,negative,avoid hot weather,Try to avoid really hot days   the park can get brutally hot.,family,,
284489117,food/beverage,negative,lack fine dining options,Not any really fine dining locations available to the public.,family,,
513821081,attractions,negative,long lines negatively impacted,the long lines,family,no,
513821081,food/beverage,negative,high prices negatively impacted,high prices are the negative,family,no,
513821081,staff,positive,helpful staff interactions,helpfulness of staff,family,no,
513821081,cleanliness,positive,overall resort cleanliness,cleanliness of the over all resort,family,no,
513821081,characters,positive,enjoyed character meet,They really enjoyed meeting all the characters,family,no,
513821081,entertainment,positive,enjoyed seeing displays,seeing all the displays,family,no,
173586085,atmosphere,positive,park is magical place,The park is just a magical place to be.,couple,,afternoon
173586085,navigation,positive,avoiding large crowds successful,"hopefully missing the large crowds and lines with this plan. Overall, we were very successful!",couple,,afternoon
173586085,attractions,positive,minimal ride queue times,"The longest line we ever had to wait in was about 20 30 minutes (not bad, for Disneyland), and we got to ride everything we wanted to.",couple,,afternoon
173586085,recommendation,positive,recommend late visit,"If you traveling and able to stay out late, I would definitely recommend that route.",couple,,afternoon
173586085,food/beverage,negative,avoid food purchase,I would also recommend not purchasing the food in the park.,couple,,afternoon
173586085,food/beverage,positive,cost savings with snacks,I do think this saved us money.,couple,,afternoon
173586085,atmosphere,positive,magical place worth visiting,Disneyland is a magical place certainly worth visiting.,couple,,afternoon
173586085,navigation,negative,prepare for crowds,"If you visit in a busy season (like we did), be prepared for crowds and lines.",couple,,afternoon
344931022,comparison,neutral,smaller version Anaheim,Euro Disney is a smaller version of it's Anaheim counterpart,,,
344931022,recommendation,positive,enjoyable first Disney,If this is the first Disney you go to you will love it,,,
344931022,comparison,negative,Anaheim visit letdown,having been to Anaheim it was a bit of a let down,,,
646913356,general,positive,magical experience for family,had a magical day,family,,
646913356,attractions,positive,sufficient attractions small kids,there was plenty to do even with very small kids,family,,
646913356,staff,negative,inconsiderate staff rushing family,some inconsiderate staff hurrying us as we were delayed due to some baby issues,family,,
646913356,entertainment,negative,shows lacking english,many shows are light on english,family,,
264906368,navigation,neutral,well laid out presentation,Good presentation well laid out,family,,Easter weekend
264906368,navigation,negative,busy over Easter weekend,very busy but that had to be expected over Easter weekend,family,,Easter weekend
264906368,facilities,positive,convenient stroller rental,It was handy to be able to hire stroller for very young,family,,Easter weekend
264906368,entertainment,positive,enjoyable entertainment,Good entertainment,family,,Easter weekend
374125507,staff,neutral,hotel generally satisfactory,I could not fault them,,No,May
374125507,facilities,positive,favourite hotel value,this is our favourite by Far and Value for Money,,No,May
374125507,pre-visit,positive,highly recommended transfer,there service is fantastic and I would Highly recommend this Company 100%,,No,May
374125507,attractions,negative,many ride closures,Our biggest problem was the parks or lack of rides that were open,,No,May
374125507,attractions,negative,ride closures disappointing,We seriously would not have went had we of neen told these rides were closed,,No,May
374125507,attractions,negative,impossible ride queues,It made the Queues almost impossible,,No,May
374125507,attractions,negative,long ratatouille queue,"the Que for ratatouille was 3 hours one day,terrible for anyone with young kids",,No,May
374125507,attractions,negative,queues due closures,I Honestly put this down to the amount of rides that were shut,,No,May
374125507,entry/admission,negative,delayed park entry,instead it is just delaying people,,No,May
374125507,staff,negative,rude cast member interaction,"We had a cast member screaming at us because we scan our own tickets ,while she opened the door for another family with a buggy",,No,May
374125507,staff,negative,disgraceful cast member behaviour,"this cast member went on to follow us,shouting at us and pointing her finger,She has got to be the worst Cast Member I had come across in the 10 years,we have been going, utterly disgraceful carry on.",,No,May
374125507,recommendation,negative,dont book this year,if anyone is thinking of booking for this year  don't  you will not get your Value for money,,No,May
3312029,entry/admission,negative,shabby train facilities,Eurostar direct to DP was on time but shabby and toilets were terrible on outward and return journeys.,family,Unknown,
3312029,entry/admission,positive,convenient luggage service,Really appreciated the luggage service with Eurostar to Disney hotels.,family,Unknown,
3312029,facilities,negative,soaked shoes from puddles,Beware of puddles everywhere my only pair of shoes got soaked on the first day.,family,Unknown,
3312029,cleanliness,negative,pervasive smoke smell,There are too many smokers around the park even in the open air I could smell smoke everywhere,family,Unknown,
3312029,cleanliness,negative,queuing smoke unpleasant,it should be banned while queuing most of the queues are partly inside and it's dreadful to have all that smoke in a closed atmosphere and you can't escape!,family,Unknown,
3312029,food/beverage,negative,expensive food,Food expensive.,family,Unknown,
3312029,food/beverage,negative,dreadful tea quality,"Tea dreadful got cup of hot milk and water, with a tea bag to put in. Had to throw it away.",family,Unknown,
3312029,attractions,negative,queue peak times,"In between lots of queues, but we can only go at peak times as my husband is a teacher.",family,Unknown,
3312029,entertainment,positive,excellent parade experience,The parade was excellent.,family,Unknown,
3312029,navigation,positive,park size manageable,The fact that the park is small is a plus in my view.,family,Unknown,
3312029,recommendation,neutral,smoking wish,"We enjoyed it, but I do wish that smoking was banned in the park.",family,Unknown,
461308650,attractions,positive,acceptable ride queue times,even the queues didn't bother us,,,
461308650,characters,positive,engaging character interactions,characters were so good with the kids,,,
461308650,entertainment,positive,enjoyable night parade/fireworks,The night parade and fireworks made me feel like a little kid again,,,
123433644,pre-visit,positive,discounted multi-day hopper pass,We were fortunate to be offered a 14 day hopper pass through our travel agent (valid only for Australians) which was the same price as a 5 day hopper direct through Disney.,family,Unknown,
123433644,navigation,positive,easy park hopping,thoroughly enjoyed being as to visit both Disneyland & California Adventure Park,family,Unknown,
123433644,cleanliness,positive,parks maintained beautifully,These parks are done so well & maintained beautifully.,family,Unknown,
123433644,atmosphere,positive,unforgettable overall experience,"The atmosphere, parades, characters, rides & overall experience is one we will never forget.",family,Unknown,
123433644,entertainment,positive,amazing water light show,The show 'Eorld of Colour' which is in California Park is a water light show & I truly have never seen anything as amazing......brilliant!!!!,family,Unknown,
123433644,attractions,positive,fastpass beneficial weekends,The weekends are usually busy so the 'fastpass' option for rides were a great benefit.,family,Unknown,
123433644,food/beverage,positive,enjoyable turkey leg snack,Also you 'must' try their turkey legs they sell there   soooo yummy!,family,Unknown,
123433644,food/beverage,negative,expensive food costs,Food is expensive,family,Unknown,
118008364,recommendation,positive,positive park recommendation,Disneyland  really is the best place on Earth,,Yes,
118008364,navigation,positive,easy park navigation,easy to get around the park,,Yes,
118008364,attractions,positive,understanding ride wait times,"stated wait times at all attractions and rides, people have a good understanding of how long it will take to get onto a ride",,Yes,
118008364,staff,positive,universally cheery pleasant staff,staff (or  cast members ) are universally cheery and pleasant,,Yes,
118008364,staff,positive,no negative staff experiences,not have a poor experience with a single one,,Yes,
248053999,attractions,positive,rides generally quite good,the rides etc are quite good,family,No,Xmas
248053999,comparison,negative,inferior to US parks,you cant help but feel it isnt as good as the  Real Thing,family,No,Xmas
248053999,entertainment,negative,short poor xmas parade,The parades especially on xmas day where very short and poor,family,No,Xmas
248053999,atmosphere,negative,poor nighttime park lighting,the lighting at night practically non existent,family,No,Xmas
248053999,food/beverage,negative,limited expensive food choices,the food choices where very limited and expensive,family,No,Xmas
248053999,comparison,negative,diluted Disney Magic,Paris in my opinion does not capture the Disney Magic but rather is a diluted version of it,family,No,Xmas
248053999,navigation,negative,appalling badly organised buses,Also the bus service to the hotels was appalling and very badly organized,family,No,Xmas
217123982,recommendation,positive,enjoyable for children,"Nice place if you have kids, For sure they will enjoy and have fun",family,,
217123982,entry/admission,neutral,acceptable ticket price,price ticket was ok,family,,
217123982,food/beverage,negative,expensive food options,no way you can eat at a good price!,family,,
217123982,food/beverage,negative,poor food quality,And food wasn't good at all.,family,,
492319460,general,positive,great family experience,Great family experience for our family.,family,Unknown,
492319460,atmosphere,positive,loved Tomorrowland theme,We are Star Wars fans and loved Tomorrowland.,family,Unknown,
492319460,characters,positive,enjoyable character meet,My boys took part in Jedi Training and met Darth Vadar.,family,Unknown,
492319460,food/beverage,positive,enjoyable themed churros,We had light saber churros,family,Unknown,
492319460,attractions,positive,enjoyed popular rides,rode Space Mountain and Star Tours many times.,family,Unknown,
492319460,navigation,negative,excessive park crowding,I hate crowds and Disneyland has many!!,family,Unknown,
492319460,timing,negative,cannot see park day,You can't see Disneyland in a day,family,Unknown,
492319460,pre-visit,positive,plan trip beforehand,so have a plan,family,Unknown,
492319460,attractions,positive,fastpass queue management,use your fast passes wisely,family,Unknown,
248642281,navigation,positive,easy access by MTR,"can be reached by MTR easily, around 20 minutes from Jordan MTR",,,
248642281,entry/admission,neutral,entrance fee information,entrance fee is around 68 usd,,,
248642281,timing,negative,avoid holiday weekend visit,avoid public holiday weekend to visit if you wanna try all the attractions,,,
248642281,retail,positive,reasonable souvenir pricing,souvenirs price are reasonable,,,
248642281,attractions,positive,well packaged attractions,most attractions are well package,,,
248642281,pre-visit,neutral,check website for closures,attractions that not open due to some reason can be checked in advance in their website,,,
374815127,recommendation,positive,Disneyland a must see,A must see with a nice MTR ride from Hong Kong Kwaloon Island,family,,2016
374815127,comparison,neutral,smaller than other parks,"Smaller than its bigger ones in Paris USA, but it happens to cover all prime attractions.",family,,2016
374815127,entertainment,positive,parade is a must,The parade is a must watch.,family,,2016
374815127,entertainment,positive,fireworks over castle,Lastly followed by fireworks over the castle,family,,2016
374815127,atmosphere,positive,paradise for family,Its a paradise for family outing in Hing Kong.,family,,2016
273188471,attractions,positive,many available attractions,There are many attractions,family,,
273188471,navigation,positive,park was not crowded,it was not too crowded,family,,
273188471,timing,negative,avoid crowded public holidays,"try to avoid public holidYs in the mainland China, as many mainlanders come to visit during holidays, then it gets very crowded",family,,
273188471,entertainment,positive,enjoyable night show,Stay for the night show and fireworks.,family,,
