Review_ID,Rating,Year_Month,Location,Review_Text,Branch
277926719,5,2015-04-01,United States,"Oh my goodness, how can you not love Disneyland? I've been coming since i was a teenager and since having our daughter, we introduced her to the happiest place on earth. When living in So Cal, we always had a season pass so we went all the time. Your best bet is to purchase park hopper tickets, minimum of three days, and if this is your first visit and can afford it, go for the 5 day hopper. There is nothing to dislike about the park, maybe with the exception of some rude tourists, but you have that regardless of where you travel. The lines are not too bad during the week, especially when school is still in. Try avoiding the summer if you can, really hot and super crowded. There's lots of places to shop and eat at, prices are high, but for the convenience you can't beat them. The service from park employees was fantastic. One of our party had to use a mobility chair and the ride attendants were fantastic about taking care of him.",Disneyland_California
567391341,5,2017-04-01,Australia," What can I say... greatest place on Earth, even for adults. There's so much to do here. I do recommend that you visit rides ahead of time and get a 'fastpass'. This tells you what time to come back so saves time in lines. Can easily spend a whole day here and only see half the park. Wear comfy shoes! Plenty of places to buy food and drinks. We also used the Disney app to help find our way around. I also recommend buying a 'park hopper' pass as this allows you to move back and fourth between Disneyland and California Adventure. ",Disneyland_California
634717570,5,2018-11-01,United States,"First of all, I am a Disney nut! Multiple trips to Disneyland and Disney World, Multiple Disney cruises, and a Disney Vacation Club member. Never having been to a Park outside the US, I did a lot of reading of reviews and comments. I realized that it wouldn't be Disney World, and I really downgraded my expectations based on what I read. I was completely surprised by my experience at Disneyland Paris. The Park is beautiful. It's smaller than Disney World, but what isn't? I thought the landscaping, the buildings, the restrooms and the rides were extremely well kept up. And in the Parks and hotel, I had nothing but positive interactions with Cast members. So much for the negativity I anticipated.The rides and attractions were a combination of familiar and new. And many of the familiar had different twists. Big Thunder Mountain is much more of a thrill ride, starting with the initial rush under the lake to get to the  mountain . Pirates of the Caribbean is a longer ride with more theming. Star Wars Hyperspace Mountain seemed a bigger thrill ride here. Buzz Lightyear, Star Tours, and It's a Small World were all familiar and well done. A couple walk thrus that were unique were the Sleeping Beauty Castle with Stained glass windows on the balcony, and a dragon in the basement. I also really enjoyed the walk through of Alice's Curious Labyrinth. My only disappointment was that Phantom Manor and the Indiana Jones ride were closed for refurbishment. Lots of the normal Disney option for dining. We enjoyed the Moroccan buffet at the Agrabah Cafe.This Disney Park did not let me down. Go with a positive attitude. Oh, and if you go in November, there will still be lines, but it will be cold.",Disneyland_Paris
397685579,3,2016-07-01,United States,"Some rides have been updated which is good, however, some rides need to be upgraded especially with new technology. What was disappointing was that all of Tom Sawyer island activities were closed. Looks like its being worked on. Seems like they should do it in the slow season not in the middle of peak season (summer). ",Disneyland_California
143438448,5,2012-10-01,Thailand,"Last time i looked Japan was in Asia so lets look at Hong Kong Disney(the other Disney in Asia). First and most important don't try and compare with Florida (ITs a lot smaller yeah we know that already). Having said that Parents wake up!!!!!!!!!!!.... Disney (if you are a parent) is not a day out... its a military operation. How to make sure your kid doesn't wait in a queue for longer than 20 minutes? First arrive before anybody else (my wife and child were ripped from their beds as they are disney virgins..the early bird really does catch the mouse,duck, goofy). So you get in... go straight for its a small world... dumbo... pooh. ok so thats the first 30 minutes and fantasy is almost all over. next its toy story it will take 1.5 hours at worst. Oh no i haven't seen any photos yet you might say..... get real the photos will be there all day. The parades are only 2 deep so kids on shoulders can easily see the parade ( I had a mixed view of a nike t shirt and Disney characters       my daughter got to see the parade and I got to see the smiles and hear the laughter (enough for me)) At 7:30pm went on astro blazers (shooting toy story game) 10 times yes ten times no waiting in line just getting on.... and going on and on and on. Lunch at 2pm no waiting in line. I think i've shared enough secrets but the last thing is be careful .. don't wait till the fireworks if you need to take the MRT its a crush. The early start will finish of the little ones. Good luck mums and dads. Remember it's a war out there",Disneyland_HongKong
158736862,5,2013-04-01,Australia,At 52 you would think I'm crazy.But it was everything I thought it would be when I was just a kid.Iguess even big kids can still have fun.,Disneyland_California
139352982,3,2012-09-01,United Kingdom,"A quick trip to France, so we thought we'd take in Disney, to keep the kids happy.mmmmmmmmmmOnce you've done american then this is no comparison.Found this to be very cramped and dated, in need of a lick of paint and a facelift.Some of the rides were closed for refurbishment, not what you pay forChoice of rides did seem very limited.Staff were friendly enough, but some of the visitors there, seem not to understand anything about people skills..very rude, arrogant and some in need of a good wash.All in all disappointing, but once you've done America, then why settle for second best",Disneyland_Paris
280939904,3,2015-06-01,United Kingdom,"Six of us, four adults and two children have just spent four days at the Park. This is not a cheap holiday and so we were most disappointed to find that at least six of the attractions were closed and one we were on broke down. This meant there were fewer things to see and the queueing time was made worse. The food offer is monotonous, overpriced, and again led to long waits. There were no smoking zones so people were able to light up everywhere that was not an attraction. Having said that it is all about the kids and they were happy. The attractions may not now be sophisticated enough for teenagers.",Disneyland_Paris
200248223,5,,United Kingdom,"I visited disney land on 02 04 and 03 04. I had initially planned two days for the two parks but the kids and we loved it so much that we added a third day to it. Yes , there is a large crowd, yes there are long queues esp. for the 'meet the princess' . But, this is expected as its a renowed resort attracting people from every where. Yes , there are people smoking and some do throw litter around, some jump the queue, some push, but its not disney's fault. The staff do there best to keep the resort  park clean. But the people shoulf behave civilised.The park is great, the atmosphere is lovely. The parades were lovely, the 'disney dreams' show is amazing. 'Meet the princess' was great. Kids loved it. The staff all over the park was superb, amiable and welcoming. It involves lots of walking, but some how the kids find the energy. I don't know why the people complain about food prices, Mc donald's provides good value choice. The disney merchandise shops are lovely though expensive but thats not unexpected, but who goes to disney to save money..Loved our trip..great memories to cherish..",Disneyland_Paris
179656207,4,2013-10-01,United States,"I really love this place, but things need to change! Rides are getting old and tiresome. The Hotels are so expensive, it hard to justify staying there and the food in the park is really outrageous, but other wise, it is Disneyland! The Happiest place on earth   lol",Disneyland_California
120698200,5,2011-11-01,United States,Who doesn't love Disneyland? The park was literally empty! Walked right on to most rides for two days of bliss.,Disneyland_California
332318286,5,2015-11-01,United States,"Took Family to the park, same entrance area as Traditional Disney park. Was worth the extra. Would need two days, minimally, just to walk past all that is inside.I did use the ?multi park tickets, a bit, but, not much need, easiest to stay in one park, first days, then, last days, use Multi park tickets, for your last day or two, only, unless you know the parks, been there before.My first trip, I spent three days, all in one park, and still was not half done with what I might have wanted to do.Expect to pay 45 dollars for lunch for three people, including kids.You can easily carry a back pack around, with water bottle s, and snacks, etc, and, carry the back pack onto rides, easily..I carried the back pack for the whole crew, and, the others carried a mini back pack, and, that worked well: water drinks, snack foods, to delay having to have TWO meals inside the park, ( after having breakfast at Denny's), worked well.The  fast pass  system, is worth looking into, waiting in lines is likely to slow the whole day. Disney has a way of making lines look sorta NOT long, but they wind, roll, twist, and are endless, up, down, all around, but so, you cant see the line is a mile long as you get in one. When they say wait time is 60 minutes, they know it is, they have people tourists, carry something that times it. A Fast Pass, shortens a one hour line to a five q0 min line.Beat the long lines by staying up late: wait times for popular rides are about ten minutes, after ten pm, and, the park is open till at least Midnight.I rode the same 'star wars ride three times, including wait time, from 1130 pm, till midnight. Once in line, even if after midnight, you DO get to ride.Watch for the Parades, worth getting a good spot along the way. The shows, are top notch: live performance, with skilled actors actresses. Musicals, yes, but, colorful, and all seats are good views, worth the lines.",Disneyland_California
260133202,5,2015-03-01,United States,"Been to Disneyland many times, but hadn't been in nearly fifteen years.  It was different and so much better.  Fantasmic is  something you SHOULD NOT MISS!!!  FOR SURE!!!  Better than I remember it from all those years ago!",Disneyland_California
431385279,5,2016-10-01,Australia,"It's a cliche but this really is one of the happiest places on earth. From the moment you get off the bus or tram or walk down to the main entrance it begins with those familiar tunes bringing a smile to your face. The park itself is always immaculately clean and the gardens beautiful (never seen a gardener there so I guess it's all done magically ). Let's be realistic though not everything is perfect everyday (rides closed, too crowded etc.) but, and it's easy, you just ignore those things and enjoy yourself and make the most of everything. Serious gripes would be inconsiderate guests with strollers barging through and people in scooters doing the same thing. Some courtesy from these (not all) would make it an even happier place if that was possible. I experienced the Halloween Party on my last visit. It was fantastic. Less crowded with the only queues being for the Haunted mansion and Space Mountain   dark rides that I had visited during the day without the queues, go figure. The new parade and fireworks lived up to expectations. It's nice to see the villains getting centre stage for a change. A great night. Last of all a word of praise for the cast members   their friendliness and helpfulness was outstanding. Their attitude is a huge contribution to the happy atmosphere in the park. Can't wait for my next visit in 2017. ",Disneyland_California
278675269,4,2014-07-01,Indonesia,"We went on December, so it was very cold. The queue was very bad since everyone's going there for new year eve. However, HongKong Disneyland has better fireworks shows compared to the DIsneyland Tokyo.",Disneyland_HongKong
133043708,5,2011-08-01,Canada,"We've been driving down to California from Canada every other summer or so and have been to Disneyland on several different trips. We like to think we are now pros at visiting the park and we have a few tips to share on making the day pleasant.First off, get fastpasses whenever possible. My husband and I will split up to travel the park better and he'll go get fastpasses and we'll wait in line. Some rides are not busy early like Pirates so we'll go on those and save the new rides for waiting in line since they usually don't have a fastpass available. Sometimes we'll head to the park early, leave in the heat of the afternoon to go back to our hotel for a nap or swim, then return in the evening when it's cooler and less busy. People with really small kids, I recommend staying on site and give yourself a day off inbetween disney to chill by the pool. It's hard to watch exhausted little kids have a breakdown at the end of the day because it's too much going 7 days straight. Chill out and take your time.We have an older child so we can travel the park easily without strollers. California Park has bigger faster rides (the roller coaster is the best I've ever been on, so smooth). Everything in Disney is top notch, it is a well oiled machine. It's clean, the staff are great and we always have a blast.People complain about the food. We have found the best way to do disney is to bring our own food and water. We partially freeze water in bottles the night before and then fill and take them with us. They stay cold all day and we never have to buy water. We make sandwiches and bring veggies and fruit. This is much more satisfying to eat than greasy food onsite. We love having our own little picnic at Disney and no one has ever said anything about it. If they ask, I've been told to tell them due to dietary restrictions, you have to bring your own food. We will get treats on site like icecream in downtown disney but we refrain from spending money on trinkets that will end up in a drawer at home. We usually get one small souvenier like an ornament or a t shirt. The Aladin show is great but it's been running for many years and I'm not sure why they haven't put together a new show. That's my only complaint, to update this show. Other than that, the parades are great, world of colour is amazing and the rides are fun, charming and clean. We're so excited to go back down this summer to see the new Cars park.",Disneyland_California
463279754,1,2017-02-01,United Kingdom,"Am here with friends. No less than THREE times did we queue for an hour, reaching the front of the queue, only for the ride to break down entirely and the staff to send everyone away without any explanation or compensation. The park seems woefully ill equipped to deal with wet weather (have they not realized that some rides are outdoors?) and is in no way close to being able to deal with large numbers of visitors. We are here in winter, I assume that coming here during peak period is like holidaying in Gomorrah as God burns it down. At the RC Racer, passengers were literally TRAPPED in the vehicle for ten minutes with no staff attempting to explain (see attached picture). Currently in the restaurant having waited twenty minutes in the queue to join the queue. For the extortionate amount we paid, standing in queues (which is fine) WITHOUT getting on the ride is unforgivable and not worth the money. ",Disneyland_Paris
162628856,5,2013-05-01,Hong Kong,"I'm from Orlando (Ocala) and so there is not much about this place that will add to its reputation other than to tell you my 4 year old son thinks it is fantastic!! He loves it, has season passes and would go there every day if he could.!!",Disneyland_HongKong
303705786,5,2015-08-01,Bahrain,When u go there ull feel like u never get old... everything will catch ur eyes... stay tuned with the parade during the day and amazing fireworks at the night its a musssst...,Disneyland_HongKong
424224990,5,2016-09-01,Australia,"Just returned from Disney, it was amazing!Kids had a wonderful time and we were amazed at the cleanliness and effort put into the park. The rides were enjoyable but are probably better in California adventure but the atmosphere was just great.We found plenty of characters, getting early access was really great, it gave us a head start on queues but also helped us find stuff without the crowds.Our girls wanted pictures with the 'cast' and had makeovers at the bibbity bobbity boutique early (it was actually really good) and meant they had some great pictures. I would recommend the photo pass, watch out though the app shows a daily charges of $39 a day but the website has a week offer of $69 if you are there for more than a day.Things to do:Indiana jonesSplash mountain Star tours (nice break from princesses)Space mountainHaunted mansionPiratesThunder railwayThe rest is ok but some warnings, the Peter Pan ride is always mobbed (45 min average wait time) and it's not very good, I have no idea why it's so busy. The jungle cruise is pretty lame but funny and the 'it's a small world' is just really weird and 20mins of your life plus queue time you will never get back, don't do it!",Disneyland_California
218756424,5,,United States,It's Disneyland where do you even start? For February it seemed pretty busy but not to the point where it was miserable. Splash mountain is always a blast.,Disneyland_California
580950950,5,2018-05-01,Australia,Disneyland Hong Kong truly is the one of the best places on earth to go and see . You don   t even need children to have a good time .it was just my husband and myself.,Disneyland_HongKong
223012411,5,2014-08-01,United States,The original Disney at it's best. The best part is Cinderella's Castle followed by the characters that greet the visitors. There are rides for all levels of fun and shows that give you time off your feet. The food is expensive. The parades are entertaining. If you want to catch a short line   visit the rides during parade times. ,Disneyland_California
238878735,4,,India,Me and my wife decided to experience the magic of Disney land Paris so we bought a half and half ticket to both Disney land park and Disney studios. And it was worth spending our money on. Booking tickets in advance will be beneficial as you won't have to wait in a long queue plus online booking might have some good discounts too. Both the park and studios have good rides to be on. Remember to start your day early so as to take maximum advantage. Get the map at the entrance and plan your day to not skip the  must do  rides. The parades were very enchanting which gives a true Disney experience. This is a true family theme park for kids of all ages. Don't miss the hotel ride in studios. ,Disneyland_Paris
142485445,5,2012-04-01,Egypt,I loved every thing .. The games the Castles .. Downtown ..the parade and fireworks .. The food ..the landscape .. Every thing ..and it is my dream to see Disneyland in my country ..Egypt .,Disneyland_California
326830950,4,2015-06-01,India,Visiting Disney land is a dream for everyone . though ticket is comparative expensive . and its huge and no battery operated bike or car available so get too much tiring walking by foot . every exit takes you to souvenir shop and it attracts kids too much. ps. don't go there on public holiday and weekend . i went there on sat and it was too crowded . every ride waiting was atleast 30 45 mins. go early so that you can enjoy everything.,Disneyland_HongKong
166365483,2,2013-07-01,United States,"Our family of 5, kids ages 9, 12 and 14 spent 5 days in France. We had the idea that Disneyland Paris would be a way to have a kids day and leave the museums for a bit. Maybe even get away from all the smoking in Paris The parks were nice enough and the rides were nice. Space mountain and crushes coaster are very good. Different than the ones in ca and fl. The people working were nowhere near as efficient as I would expect from Disney. We would see trash on the walk ways, people cutting lines, kids playing frisbee near ride entrances and worst of all, smoking everywhere. It almost seemed like Disney was trying to save money and not hire as many people to maintain crowds and keep the place cleanThe smoking pretty much ruined our experience, I asked one employee who was a manager of an area and he told me that even though there are signs for no smoking all over, they just don't enforce it. It's part of the culture he said.I would not go back again",Disneyland_Paris
264155735,2,2015-04-01,United Kingdom,"Two of us went to the Paris disneyland park over the Easter weekend and had a really disappointing time. Despite focussing on getting on as many rides as possible (we even ate lunch in a queue) we only managed four rides in a full day (three if you don't count the haunted house)! We queued for an hour for Indiana Jones before being kicked off because the ride had broken down, Space Mountain was closed, and we were turned away from Pirates and Thunder Mountain (the first time we tried) because they had temporarily broken down as well!Although the parades were kind of fun, there were no characters walking around, the rides weren't particularly well themed (e.g. the thunder mountain and the haunted house didn't even have disney themes), and so I don't see what Disneyland has over parks that actually have good rides.",Disneyland_Paris
528991432,5,2016-11-01,Canada,"what can I say every kids dream to go to Disneyland. it so much fun when your young going on the rides and seeing the parades. so much to do here, but make sure you get a early pass to beat the lines on all the rides and another tip stay close to the park too save money on parking. ",Disneyland_California
281157737,3,2015-05-01,United States,"Was fun and exciting for the first time.  Not too many characters around, parade was fun, light show was great.  Just so darn expensive 4.50 for water OMG  Corn dogs were 7.50 but really good.",Disneyland_California
