Review_ID,Rating,Year_Month,Location,Review_Text,Branch
531138321,5,2017-09-01,United Kingdom,We visited for Mickey;s Not So Scary Halloween party this was the first night of the events scheduled. The park was very busy with really long ride lines. The main parade was good and the fire works excellent. Trick or treat staions were set up throughout the park. This is one of our favioute times to visit as the costumes are at their best with the addional theme. Worth the ticket price as you can visit both parks on the same day and enter from 3pm.  ,Disneyland_California
25004598,1,,United States,We arrived on 15th February 2009 and were due to go home on the afternoon of saturday 21st February. We hated it so much we left on the morning of Friday 20th as we had had enogh! The queues for the rides were absolutely enourmous most were 90 minutes wait. Having two young boys aged 5 and 10 and a 6 month baby we couldnt wait around for that long for a ride. Really rude people and really really expensive food. We had luch on the first day at pizza planet and spent   65 just on a salad 2 small pizzas and drinks. Dinner usually came to   100. We stayed at davy crockett ranch and it was filthy in the accomodation. We all caught sickness bugs whilst there.,Disneyland_Paris
155279085,5,2012-12-01,United States,Nothing really new in the Magic Kingdom from the previous year when we were here. Indiana Jones ride down most of the day so we didn't get to do that. Crowds were terrible later in the day. The Haunted Mansion is always a treat at holiday time as is the parade. Our favorite part of the park is New Orleans Square. Great atmosphere and food. ,Disneyland_California
3460644,1,,United States,"My husband and I recently returned from a long weekend in Paris. Since we were ahead of schedule, we thought we would catch some Euro Disney Magic! What we caught was very long lines, Fast Pass booths closed, several attractions closed, too many restaurants cafes and too few attractions. The staff was terrible at loading attraction cars   normally, you line up and they try to fill all the seats, right? 20% of the cars that went by were empty. Also, in six hours, we did not see ONE charachter! It was unbelievable considering that it was so busy. At best, it was lousy. If you are an American, you will most likely hate it. Another poster said the entrance was beautiful, but it went downhill FAST after that. I agree. Also, be careful if you take the RER out to Disney from Paris. Be sure your fare is correct before you arrive as you insert your RER ticket for entry into the Park. If your fare is short, you are locked out and you have to buy a  violators ticket  for 25 Euro. Europa Park in Germany is 10 X better.",Disneyland_Paris
594693531,5,2018-07-01,United States,"You will definitely want to plan out your day, and make the most of it by getting there early and if possible using an Extra Magic Hour to get some more time. Use Fastpass. We paid extra for MaxPass and for a small party (two of us), it was worth it but I can see where it can be cost prohibitive for larger parties.Be sure to allot enough time to park your car, go through security, and get into the park. Don't arrive at 8:45 and think you're getting in at 9:00   go 30 45 minutes earlier than when you want to be inside   even earlier on busier days.If you're staying at a Disney resort   or even a nearby hotel on Harbor Blvd. or Katella Ave.   consider taking a break. If your hotel is a bit further away (or you're a local and don't already know this), you can also visit the Disney hotel restaurants bars for a break   in addition to those in Downtown Disney.Make sure you pay attention to showtimes or special hours for certain attractions (i.e., the Sailing Ship Columbia), as they don't operate the entire time the park is open.",Disneyland_California
434171596,5,2016-11-01,United States,"We love love love the park. We have visited most of the Disney parks and this is our favorite. Make sure to grab a Dole Whip and the must do rides are, Indiana Jones, Pirates, and Splash Mountain. We found Matterhorn way to bumpy to enjoy.",Disneyland_California
281038718,3,2015-06-01,Singapore,"Went to Disneyland Park yesterday with my 7 year old. We had an amazing time but we were somewhat disappointed at least three rides were shut (space mountain, carousel and one other), there were no crowd control at the railway station, resulting in a lot of pushing and queue cutting which upset the people who spent 20 minutes queuing up before the train arrived.Some of the staffs were shouting at the patrons to get back in the queue etc, I feel that they should try to put it across nicely even though it may be for the patrons' own safety. Be prepared to wait at least 20 50 minutes for most rides and there is only 1 fast pass allowed at any one time. I've been to 3 Disneyland so far and this is the only one that we did not really enjoy. There are too many restaurants and too few rides for the kids....",Disneyland_Paris
339557119,5,2016-01-01,New Zealand,"What at amazing disneyland experience for the kids, to come here and have no queues...the longest we waited was 20 minutes for Its a Small World. Everything else was straight on. The xmas theme was great fun. I highly recommend this as an off season destination for a great family day out   if you dress warmly you won't even notice it's winter.",Disneyland_Paris
387623383,5,2016-06-01,United Kingdom,"Make the most of fast passes, always get one when you can. This place is truly amazing make sure to stay for the parade and fireworks at the end of the day. Honestly cannot say how amazing it is. Also breakfast at the plaza inn is a great way to meet characters without the queues and the food is amazing!",Disneyland_California
121300679,5,2011-11-01,Australia,"Plenty of rides that delight smaller kids.  A few  grown up  rides but not enough to go there for that reason.  Very clean park.  Fastpass access should always be purchased, very handy.",Disneyland_HongKong
379889384,5,2015-07-01,United States,"As with all things Disney in CA and Florida, Disneyland is just a fun, first class and varied amusement park.   Great for couples and families and groups of friends and Disney makes everything and everyone feel great!",Disneyland_California
195872800,5,2014-02-01,United Kingdom,"Visited Disneyland Paris in February 2014 with my 4 year old son and had a wonderful two days in the parks. We went over the school holidays so expected it to be a bit busy. The park is very clean and well presented and the staff were happy, friendly and willing to help. Could have done with a third day.(we know for next time)  Food and drink are expensive in the parks as expected.",Disneyland_Paris
156496430,3,2013-03-01,United Kingdom,"This was our 4th visit to Euro Disney and although we had a fantastic break it was definitely not what it used to be in that;People were smoking all over the park including while waiting in queues.Many rides with the same carriages were broken day after day causing longer queues than necessary.No ghosts on the back of the Haunted House Ride?Both times Screen Studio Tram Tours the commentary screens were not working.Music was not always working on the Aero Smith Roller Coaster. Pirates water ride and Crush ride both broke down while we were at the park.Very limited number of rides operating during the parks early opening hours.Lots of restaurants and food stalls were not open for the duration of our visit, therefore massive queues at the ones that were.Captain EO   awful   not a patch on the fantastic 'Honey I shrunk the kids' previously showing.Food unbelievably expensive.",Disneyland_Paris
111698723,5,2010-07-01,India,Difficult to cover both park in one day.Best to cover one part in one day and take combo passIt suitable for kids and family and one of best in california for family.Timing from Monring 6 to evenig 8pm and best time to trave in weekdays to avoid rush,Disneyland_California
271807920,5,2015-03-01,United States,This trip was special because my husband and I were celebrating my admittance to graduate school. The park was immaculate per usual. The wait times were not bad and we were even able to get a reservation at Blue Bayou. All the cast members we interacted with were wonderful. I can't wait to go back!,Disneyland_California
391603753,2,2016-06-01,Germany,It was my second time to Disneyland after having been there as a kid approximately 20 years ago. I went there with two friends and was really looking forward to relive the experience. But when we arrived there we realized that approx. 80% of the roller coaster rides were closed (only one roller coaster in the park opened). There was no transparent communication to this extensive maintenance work. On the map you could see that the attractions marked with a tiny Mickey Mouse head were due to maintenance at some point in time but you had to walk the whole way to see if they were closed today or not. Additionally it was end of June   so you didn't expect such a high proportion of attractions to be closed in the mid of summer!It is also valuable to mention that throughout the whole park there is a ban on selfie sticks  for security reasons  and the value for money in the restaurants is really poor.From my point of view it is a nice experience for children. For adults there are better parks in Europe.,Disneyland_Paris
240165727,5,2014-09-01,Canada,We had a wonderful time. Disneyland is truly the happiest place on earth. The shows were excellent. The staff are friendly and helpful.,Disneyland_California
261174469,5,2015-03-01,Australia,While this is our first Disney experience it was a good one to start with. My 8year old granddaughter was able to navigate her way around the park and go from ride to ride and world to world a few times throughout the day. She was also able to ride by herself when I did not want to go for for the 5th time in a row. We loved the the magic of the street parade as a fitting climax to a great day out.,Disneyland_HongKong
190463633,4,2014-01-01,United States,"It's been many years since we were there. It was much more crowded than I thought   but once we got the hang of fast pass, it worked well. It was the first time we ever visited when the park was in holiday theme. Disappointed by the Haunted Mansion holiday makeover but appreciated some of the new touches in Pirates (Captain Jack Sparrow made us appreciate how the animatronics has improved over the years.) ",Disneyland_California
82508536,3,,Australia,"It's one of those places I felt the need to visit just once in my lifetime. I did feel disappointed however. The price to get in for our family of 4 (for a 2 day hopper pass) was nearly $600. I did not feel the place justified such a high entry fee especially since there were still so many things you had to pay for once inside.Kids (8 & 10) were over it by the first day. We had to force them to come back for day 2 and we ended up leaving after just 4hrs, due to everyone being tired of walking and waiting in long queues. I heard other kids complaining to their parents and wanting to go back to their hotels.For a place that is supposed to be the happiest place on earth, there sure were a lot of miserable looking parents and kids walking around.The food available for purchase inside is another story   I wouldn't feed that kind of food to my dog! So unhealthy and disgusting. Don't eat at Pizza Port   ended up throwing it away.",Disneyland_California
191267562,5,2013-08-01,United States,"Disneyland will always bring out the inner child within me. Every visit I make, it's like going for the first time; it's always something fun and exciting, as well as something new happens everytime I go. A trip to Disneyland is not complete without riding Indiana Jones, Big Thunder Mountain Railroad, Space Mountain, and Splash Mountain; all other attractions are enjoyable, but the ones I've mentioned are my favorites. I tend to avoid Disneyland at peak times such as Spring and Summer breaks, ESPECIALLY during the holidays as it tends to get extremely crowded; crowded places means aggravating crowds. It's fun taking pictures with the characters, hitting the rides at Fantasyland, and I'd tend to ride It's a Small World when it's re decorated for the holidays more than once! Fantasmic! and the fireworks are a must see! I'd keep going there, and I doubt I'll ever get bored.",Disneyland_California
250313963,3,2015-01-01,United States,"Being from the US, it is easy to have in your mind, how all Disneylands are supposed to be. Well, drop the bar because the HK Disney is much smaller and therefore missing the key attractions we are used to. But the biggest thing missing is the food. Don't come here expecting to eat US food anywhere. Even the popcorn is different   honey mustard flavored. The chocolate dipped banana is packaged in bite sized pieces. I will say the mango Dole whip was the highlight. We ate on Main Street at the Coca Cola branded restaurant and it was meh. Nothing Coca Cola at all but the location was right for the night time light parade. We had a little extra show as there was a HKer yelling at a Mainland tourist for what appeared to be a cutting in line.Kids loved the Thunder Mountain like ride because there was a twist when the ride went backwards. Loved shopping in the Main Street store. The mugs are really cute and a few of the shirts were nice. Most of the shirts are garrish; very loud and overly detailed. Yuck.The train is cute with Mickey shaped windows and handlebars. There is a display in each train which has an enclosure with a bronze like character inside.Would I go again? Nope. Check on the bucket list. We got lucky on the timing. Went on a Friday early afternoon and stayed until closing at 830. Let the crowd go ahead otherwise you are backed up on the train landing.",Disneyland_HongKong
153574756,4,2013-02-01,United Kingdom,"Had a great visit with our 2 year old son. With him being into everything Disney he really enjoyed it. On every full day we were there we made sure we were in the park for 8 to take advantage of the 2 hours without members of the public. This made the queuing alot less painful. Unfortunately one of mornings we went in early 3 of the rides that were open(not all the rides open before 10) were broken leaving you little to choose from but overall its worth going in early to avoid the queues. Some rides were closed for our entirety of our stay which was quite frustrating as if the queuing gets too frustrating for a 2 year old all your really left with is a glorified shopping centre with quite a few restaurants chucked in. On the plus sides, even though the park was busy it never felt over run with people. The staff were on the whole happy and willing to help. The parades were really good and the lights and fireworks at the end of the day were brilliant. The Buzz Lightyear Ride was one of my sons favorites, whilst my wife liked the Peter Pan ride and Its Small World Ride (Beware the theme songs sticks in your head forever . The restaurants were really good and the food was really tasty & the shops, all though all very similar were not in my mind particulary overpriced as you wouldn`t expect them to be cheap. Overall, a great experience but possibly only if you don`t mind queuing.",Disneyland_Paris
157272437,4,2013-04-01,Indonesia,"I had been to the Disneyland Parks in California and Florida, so this one in Hong Kong had an air of  not in the right place  feels to it. This park definitely is much smaller than the ones in Annaheim and Orlando, and the number of rides are also limited. But true to Disneyland tradition, the Main Street is alive and busy with music, shops, snacks and cafes. It is a nice way to spend an afternoon in the open air, after days spent inside shopping malls!",Disneyland_HongKong
246686529,4,2014-08-01,United States,"Disneyland is a must go, at least once in your lifetime. This is the happiest place on earth, being an adult I still get a bit giddy when I get my picture taken with Mickey! The kids will ABSOLUTELY Love it...even your angsty teenager! The experience is worth the wait!",Disneyland_California
292783245,5,2015-07-01,United States,"If you have not been to Disneyland yet for the Diamond Celebration, you must go. The Paint the Night parade blew my mind with the extravagant floats and the bright colors that illuminate the entire park. The fireworks were the best that I have ever seen at Disneyland  I loved the movie clips and the corresponding fireworks. Not too be missed!!",Disneyland_California
122993372,4,2011-02-01,Indonesia,"I've been to Hong Kong Disneyland 3 times, all with my tour group. The last one was in September 2010. We spent a full day there while also stayed a night at the Disney Hollywood Hotel. This one Disneyland is probably the smallest among the other Disney parks around the world; you can enjoy all attractions just in one day. The cast members speak Mandarin and English, very nice. Best time to visit it is probably around Halloween, because beside having 2 parades, the temperature is nice too. I had lunch at the Royal Banquet Hall (ramen and teriyaki chicken wings), it was good and worth the money.",Disneyland_HongKong
295783819,4,2015-07-01,United Kingdom,Its Disney and its fantastic.   Have to say food and shops are very expensive and having paid a lot to go there the extras do add up and its only the children who miss out.,Disneyland_Paris
325766317,5,2015-11-01,United States,Park fills up about 11am. Becomes more empty after 9pm. Indiana Jones one of the few that is worth the wait. Bobsled coaster not so much.,Disneyland_California
368610237,5,2016-04-01,United States,Disneys magic is alive and well.  The Paint the Night parade a must see and of course the fireworks.  During the week lines are shorter.  Well worth it.,Disneyland_California
330527464,5,2015-12-01,United Kingdom,"I would like to say how safe I felt at Disney this last few days. After recent events I had my concerns but this was unfounded. There were armed soldiers at the entrance to the train station. The screening system that was in place consisted of all bags being scanned , people being searched and full body scans. Any hint of uncertainty and rides were closed down ( haunted mansion had a bag left ,closed down within minutes and fully checked) . We stayed at the Santa Fe and increased security was evident there as well. So well done Disney.",Disneyland_Paris
129268119,5,2012-03-01,Australia,"What an amazing place, we loved it! Is a great park for both kids and adults, so much to see and do.  Make sure you give yourself 3 or 4 days to visit as you will need it to really experience everything without being rushed.",Disneyland_California
271764843,5,2015-04-01,United Kingdom,We went to Disneyland Paris from Good Friday to Easter Monday with our two boys (3 and 6). We all had a brilliant time. The rides were excellent with fairly good wait times. It helped that we stayed in a Disney hotel and so had early access to the park. There was plenty to keep the whole family entertained. We particularly enjoyed the parade. We would definitely go back again.,Disneyland_Paris
154428410,4,2013-03-01,United States,Everyone tries to compare disneyland to disney world well....you can't! But that's ok. Disneyland is special for its history. The lands have unique experiences and rides that are different. We really enjoyed the French quarter. I just live disney and the California and venture park was just as cool. I love that its condense and you don't have to take a bus or monorail every where to enjoy yourself. The experience was magical and well worth the time to compare. You just can't go wrong in disney!,Disneyland_California
526000751,3,2017-09-01,United States,"Overall, I enjoyed my first visit to Disneyland. Luckily, I didn't have any children to bring (adults now) and would have dreaded bringing them due to the hordes of people children walking around, not to mention the awful wait times for children exhibits rides. I was surprised overwhelmed at the amount of souvenir shops. Every other building seemed to be for shopping. The themes throughout the park were fun to experience, but need to have more rides exhibits that enlighten one's knowledge of that theme. Overall, go have fun despite the looooong lines, the hordes of parents kids with strollers banging into your shins, and bring your credit card. Enjoy the parade, the exhibits, and the overall experience.",Disneyland_California
569545065,5,2018-03-01,United States,They have 2 parks if you can it   s better buy the tickets for both parks one is similar to Hollywood Studios in Orlando and the Other one its similar to Magic Kingdom. Both are magical and amazing,Disneyland_Paris
184212128,5,2013-11-01,United Kingdom,"We took our little girl who has disabilities for our first family holiday here. The staff , facilities and rides were amazing! Nothing was too much for them. The green card they gave us allowed us quicker entry and easier access to rides etc. The staff called out daughter by her name and always smiled and made a fuss! Two or three rides and restaurants don't allow push chairs but we could for our girl and wasn't a problem. The allocated areas for the parade and fireworks really helped also! I would especially like to thank Rupanzle, she spent ages with our little girl and later that day spotted here out during the parade and pointed to her and shouted  it's you!  And blow a kiss. Made my girl so happy and me and my wife nearly cry! Thank u!!!!! Can't wait to return!!! ",Disneyland_Paris
147272137,5,2012-12-01,Malaysia,"Get a 2 day pass, its well worth it as you can explore the park at a more leisurely pace. Very clean toilets and many eateries with a variety of food. Queueing time for the rides were 40 mins max and managed excellently.The LION KING show was AWESOME , we went twice for this. Dont miss it! Stitch Adventure was good too. Flights of fantasy parade was feast to the eyes!However was pretty disappointed that the Sleeping beauty castle was not lit up as magiacally as expected   looked more like a haunted castle by night ! And the fireworks are nothing to shout about.",Disneyland_HongKong
579457493,1,2018-05-01,United States,"If you enjoy the TSA screening process at airports, you'll love your visit. In fact, some items the TSA has no problems with won't pass Disney tests. Case in point. A rolled up 3 legged stool about 10 inches long (see pictures). Refused entry. Strollers the size of small cars   no problem. Seurity wouldn't allow storage in a locker, leaving the item outside the screening area, or even outside the front gate clear out by the street. Required me to personally remove the item from Disney property even after I told them to throw it away. Most Disney employees seem to go out of their way to make the guest experience great, but some of the security staff are unbelievably obnoxious and rude.",Disneyland_California
340664992,3,2015-12-01,Greece,"We visited at Christmastime 2015, was very crowded and 3 attractions broke down in the two days when we visited and almost all the attractions of the Wild West was closed. We had to queue for 45 minutes to 1 hour to each attraction. Considering the amount of money you pay as a family of 4 and although all in all the kids had a good time (but very very tiring with all the crowd) I don't think we will ever visit again.",Disneyland_Paris
257739559,5,2015-01-01,United States,"Disneyland is a time for my daughter and I to spend quality time together. We have annual passes and go as often as we can when she's in town. Whenever we go, we always try a different place to eat. It's a great place to get some exercising while doing lots of walking.",Disneyland_California
282292543,4,2014-07-01,United Kingdom,"Went here a while ago and forgot to put my review. I loved Disney Land.. the parades were amazing, good rides, good things to do throughout the day, get to have signatures off the characters which was cool:) Only negative is that the french are very rude (they push you out the way to get in front)",Disneyland_Paris
139436725,3,,United Kingdom,"Disney World far out does Disneyland in Customer Service, rides and atmosphere. We arrived during the Labor Day week end. On purchasing our tickets we were advised it included a 'early bird ' admission at 7am and that was good for either the Saturday or Sunday we duly arrived at 7am the Saturday to find the parks were closed until 9am due to a marathon run. It's fair to say it was annoying to both my group and others we encountered not because of the run just the lack of communication.On entering the park at 9am I spoke to a man at the gate who said he was the Manager,I told him of my   our frustration on not being aware and his reply 'I've known for months', well your staff certainly didn't. Fortunatly the rest of he crew were not as smug as the manager and a lady called Emily could teach her manager one or two things about being helpful and polite. ",Disneyland_California
246145542,5,2014-12-01,United States,We are used to Disney World in Florida so this one is small by comparison.  But very clean.  Everyone was friendly and there were many similarities..but fewer rides than I had expected.  Glad I experienced it.,Disneyland_Paris
255545635,4,2014-12-01,Malaysia,"Lots of people when i visited in December. Overall found that the Disneyland is too small compare to Disneyland in Paris. Good for family with children. If for adults, can opt for Ocean Park than this.",Disneyland_HongKong
